Year,Category,Name,Birthdate,Birth Place,County,Residence,Role/Affiliate,Field/Language,Prize Name,Motivation
1929,medicine,Sir Frederick Gowland Hopkins,1861-06-20,Eastbourne,United Kingdom,,"University of Cambridge, Cambridge, United Kingdom",,The Nobel Prize in Physiology or Medicine,The Nobel Prize in Physiology or Medicine 1929 was divided equally between Christiaan Eijkman for his discovery of the antineuritic vitamin and Sir Frederick Gowland Hopkins for his discovery of the growth-stimulating vitamins.
1929,peace,Frank Billings Kellogg,1856-12-22,Potsdam NY,USA,USA,"Part-originator of Briand-Kellogg Pact, ex-Secretary of State", Negotiation,The Nobel Peace Prize,The Nobel Peace Prize 1929 was awarded to Frank B. Kellogg.
1929,physics,Prince Louis-Victor Pierre Raymond de Broglie,1892-08-15,Dieppe,France,,"Sorbonne University, Institut Henri Poincaré, Paris, France", Quantum mechanics,The Nobel Prize in Physics,The Nobel Prize in Physics 1929 was awarded to Louis de Broglie for his discovery of the wave nature of electrons.
1930,chemistry,Hans Fischer,1881-07-27,Hoechst,Germany,,"Technische Hochschule (Institute of Technology), Munich, Germany","Organic chemistry, natural products chemistry",The Nobel Prize in Chemistry,The Nobel Prize in Chemistry 1930 was awarded to Hans Fischer for his researches into the constitution of haemin and chlorophyll and especially for his synthesis of haemin.
1930,literature,Sinclair Lewis,1885-02-07,Sauk Centre MN,USA,USA,, English,The Nobel Prize in Literature,"The Nobel Prize in Literature 1930 was awarded to Sinclair Lewis for his vigorous and graphic art of description and his ability to create, with wit and humour, new types of characters."
1930,medicine,Karl Landsteiner,1868-06-14,Vienna,Austrian Empire (now Austria),,"Rockefeller Institute for Medical Research, New York, NY, USA",,The Nobel Prize in Physiology or Medicine,The Nobel Prize in Physiology or Medicine 1930 was awarded to Karl Landsteiner for his discovery of human blood groups.
1930,peace,Lars Olof Jonathan (Nathan) Söderblom,1866-01-15,Trönö,Sweden,Sweden,"Leader in the ecumenical movement, Archbishop", Peace movement,The Nobel Peace Prize,The Nobel Peace Prize 1930 was awarded to Nathan Söderblom.
1930,physics,Sir Chandrasekhara Venkata Raman,1888-11-07,Trichinopoly,India,,"Calcutta University, Calcutta, India","Atomic physics, electromagnetism",The Nobel Prize in Physics,The Nobel Prize in Physics 1930 was awarded to Sir Venkata Raman for his work on the scattering of light and for the discovery of the effect named after him.
1931,chemistry,Carl Bosch,1874-08-27,Cologne,Germany,,"University of Heidelberg, Heidelberg, Germany, I.G. Farbenindustrie A.G., Heidelberg, Germany", Industrial chemistry,The Nobel Prize in Chemistry,The Nobel Prize in Chemistry 1931 was awarded jointly to Carl Bosch and Friedrich Bergius in recognition of their contributions to the invention and development of chemical high pressure methods
1931,chemistry,Friedrich Bergius,1884-10-11,Goldschmieden near Breslau,Germany (now Poland),,"University of Heidelberg, Heidelberg, Germany, I.G. Farbenindustrie A.G., Mannheim-Rheinau, Germany", Industrial chemistry,The Nobel Prize in Chemistry,The Nobel Prize in Chemistry 1931 was awarded jointly to Carl Bosch and Friedrich Bergius in recognition of their contributions to the invention and development of chemical high pressure methods
1931,literature,Erik Axel Karlfeldt,1864-07-20,Karlbo,Sweden,Sweden,, Swedish,The Nobel Prize in Literature,The Nobel Prize in Literature 1931 was awarded to Erik Axel Karlfeldt The poetry of Erik Axel Karlfeldt.
1931,medicine,Otto Heinrich Warburg,1883-10-08,Freiburg im Breisgau,Germany,,"Kaiser-Wilhelm-Institut (now Max-Planck-Institut) für Biologie, Berlin-Dahlem, Germany",,The Nobel Prize in Physiology or Medicine,The Nobel Prize in Physiology or Medicine 1931 was awarded to Otto Warburg for his discovery of the nature and mode of action of the respiratory enzyme.
1931,peace,Jane Addams,1860-09-06,Cedarville IL,USA,USA,"International President, Women's International League for Peace and Freedom, Sociologist", Peace movement,The Nobel Peace Prize,The Nobel Peace Prize 1931 was awarded jointly to Jane Addams and Nicholas Murray Butler
1931,peace,Nicholas Murray Butler,1862-04-02,Elizabeth NJ,USA,USA,"Promoter of Briand Kellogg Pact, President, Columbia University","Negotiation, peace movement",The Nobel Peace Prize,The Nobel Peace Prize 1931 was awarded jointly to Jane Addams and Nicholas Murray Butler
1932,chemistry,Irving Langmuir,1881-01-31,Brooklyn NY,USA,,"General Electric Company, Schenectady, NY, USA", Physical chemistry,The Nobel Prize in Chemistry,The Nobel Prize in Chemistry 1932 was awarded to Irving Langmuir for his discoveries and investigations in surface chemistry.
1932,literature,John Galsworthy,1867-08-14,Kingston Hill,United Kingdom,United Kingdom,, English,The Nobel Prize in Literature,The Nobel Prize in Literature 1932 was awarded to John Galsworthy for his distinguished art of narration which takes its highest form in The Forsyte Saga.
1932,medicine,Edgar Douglas Adrian,1889-11-30,London,United Kingdom,,"University of Cambridge, Cambridge, United Kingdom",,The Nobel Prize in Physiology or Medicine,The Nobel Prize in Physiology or Medicine 1932 was awarded jointly to Sir Charles Scott Sherrington and Edgar Douglas Adrian for their discoveries regarding the functions of neurons
1932,medicine,Sir Charles Scott Sherrington,1857-11-27,London,United Kingdom,,"University of Oxford, Oxford, United Kingdom",,The Nobel Prize in Physiology or Medicine,The Nobel Prize in Physiology or Medicine 1932 was awarded jointly to Sir Charles Scott Sherrington and Edgar Douglas Adrian for their discoveries regarding the functions of neurons
1932,physics,Werner Karl Heisenberg,1901-12-05,Würzburg,Germany,,"Leipzig University, Leipzig, Germany", Quantum mechanics,The Nobel Prize in Physics,"The Nobel Prize in Physics 1932 was awarded to Werner Heisenberg for the creation of quantum mechanics, the application of which has, inter alia, led to the discovery of the allotropic forms of hydrogen."
1933,literature,Ivan Alekseyevich Bunin,1870-10-22,Voronezh,Russia,,, Russian,The Nobel Prize in Literature,The Nobel Prize in Literature 1933 was awarded to Ivan Bunin for the strict artistry with which he has carried on the classical Russian traditions in prose writing.
1933,medicine,Thomas Hunt Morgan,1866-09-25,Lexington KY,USA,,"California Institute of Technology (Caltech), Pasadena, CA, USA",,The Nobel Prize in Physiology or Medicine,The Nobel Prize in Physiology or Medicine 1933 was awarded to Thomas H. Morgan for his discoveries concerning the role played by the chromosome in heredity.
1933,peace,Sir Norman Angell (Ralph Lane),1873-12-26,Holbeach,United Kingdom,United Kingdom,"Member, Commission Exécutive de la Société des Nations (Executive Committee of the League of Nations and of National Peace Council), Writer","Peace movement, arms control and disarmament",The Nobel Peace Prize,The Nobel Peace Prize 1933 was awarded to Sir Norman Angell.
1933,physics,Erwin Schrödinger,1887-08-12,Vienna,Austria,,"Berlin University, Berlin, Germany", Quantum mechanics,The Nobel Prize in Physics,The Nobel Prize in Physics 1933 was awarded jointly to Erwin Schrödinger and Paul Adrien Maurice Dirac for the discovery of new productive forms of atomic theory
1933,physics,Paul Adrien Maurice Dirac,1902-08-08,Bristol,United Kingdom,,"University of Cambridge, Cambridge, United Kingdom", Quantum mechanics,The Nobel Prize in Physics,The Nobel Prize in Physics 1933 was awarded jointly to Erwin Schrödinger and Paul Adrien Maurice Dirac for the discovery of new productive forms of atomic theory
1934,chemistry,Harold Clayton Urey,1893-04-29,Walkerton IN,USA,,"Columbia University, New York, NY, USA","Physical chemistry, nuclear chemistry",The Nobel Prize in Chemistry,The Nobel Prize in Chemistry 1934 was awarded to Harold C. Urey for his discovery of heavy hydrogen.
1934,literature,Luigi Pirandello,1867-06-28,Agrigento Sicily,Italy,Italy,, Italian,The Nobel Prize in Literature,The Nobel Prize in Literature 1934 was awarded to Luigi Pirandello for his bold and ingenious revival of dramatic and scenic art.
1934,medicine,George Hoyt Whipple,1878-08-28,Ashland NH,USA,,"University of Rochester, Rochester, NY, USA",,The Nobel Prize in Physiology or Medicine,"The Nobel Prize in Physiology or Medicine 1934 was awarded jointly to George Hoyt Whipple, George Richards Minot and William Parry Murphy for their discoveries concerning liver therapy in cases of anaemia."
1934,medicine,George Richards Minot,1885-12-02,Boston MA,USA,,"Harvard University, Cambridge, MA, USA",,The Nobel Prize in Physiology or Medicine,"The Nobel Prize in Physiology or Medicine 1934 was awarded jointly to George Hoyt Whipple, George Richards Minot and William Parry Murphy for their discoveries concerning liver therapy in cases of anaemia."
1934,medicine,William Parry Murphy,1892-02-06,Stoughton WI,USA,,"Harvard University, Cambridge, MA, USA, Peter Brent Brigham Hospital, Boston, MA, USA",,The Nobel Prize in Physiology or Medicine,"The Nobel Prize in Physiology or Medicine 1934 was awarded jointly to George Hoyt Whipple, George Richards Minot and William Parry Murphy for their discoveries concerning liver therapy in cases of anaemia."
1934,peace,Arthur Henderson,1863-09-13,Glasgow,Scotland,United Kingdom,"President, Disarmament Conference in 1932, ex-Foreign Secretary","World organizing, arms control and disarmament",The Nobel Peace Prize,The Nobel Peace Prize 1934 was awarded to Arthur Henderson.
1935,chemistry,Frédéric Joliot,1900-03-19,Paris,France,,"Institut du Radium, Paris, France", Nuclear chemistry,The Nobel Prize in Chemistry,The Nobel Prize in Chemistry 1935 was awarded jointly to Frédéric Joliot and Irène Joliot-Curie in recognition of their synthesis of new radioactive elements
1935,chemistry,Irène Joliot-Curie,1897-09-12,Paris,France,,"Institut du Radium, Paris, France", Nuclear chemistry,The Nobel Prize in Chemistry,The Nobel Prize in Chemistry 1935 was awarded jointly to Frédéric Joliot and Irène Joliot-Curie in recognition of their synthesis of new radioactive elements
1935,medicine,Hans Spemann,1869-06-27,Stuttgart,Württemberg (now Germany),,"University of Freiburg im Breisgau, Breisgau, Germany",,The Nobel Prize in Physiology or Medicine,The Nobel Prize in Physiology or Medicine 1935 was awarded to Hans Spemann for his discovery of the organizer effect in embryonic development.
1935,peace,Carl von Ossietzky,1889-10-03,Hamburg,Germany,Germany,"Pacifist, Journalist (i.a. <i>die Weltbühne</i>)","Human rights, arms control and disarmament",The Nobel Peace Prize,The Nobel Peace Prize 1935 was awarded to Carl von Ossietzky.
1935,physics,James Chadwick,1891-10-20,Manchester,United Kingdom,,"Liverpool University, Liverpool, United Kingdom", Nuclear physics,The Nobel Prize in Physics,The Nobel Prize in Physics 1935 was awarded to James Chadwick for the discovery of the neutron.
1936,chemistry,Petrus (Peter) Josephus Wilhelmus Debye,1884-03-24,Maastricht,the Netherlands,,"Berlin University, Berlin, Germany, Kaiser-Wilhelm-Institut (now Max-Planck-Institut) für Physik, Berlin, Germany","Physical chemistry, structural chemistry",The Nobel Prize in Chemistry,The Nobel Prize in Chemistry 1936 was awarded to Peter Debye for his contributions to our knowledge of molecular structure through his investigations on dipole moments and on the diffraction of X-rays and electrons in gases.
1936,literature,Eugene Gladstone O'Neill,1888-10-16,New York NY,USA,USA,, English,The Nobel Prize in Literature,"The Nobel Prize in Literature 1936 was awarded to Eugene O'Neill for the power, honesty and deep-felt emotions of his dramatic works, which embody an original concept of tragedy."
1936,medicine,Otto Loewi,1873-06-03,Frankfurt-on-the-Main,Germany,,"Graz University, Graz, Austria",,The Nobel Prize in Physiology or Medicine,The Nobel Prize in Physiology or Medicine 1936 was awarded jointly to Sir Henry Hallett Dale and Otto Loewi for their discoveries relating to chemical transmission of nerve impulses
1936,medicine,Sir Henry Hallett Dale,1875-06-09,London,United Kingdom,,"National Institute for Medical Research, London, United Kingdom",,The Nobel Prize in Physiology or Medicine,The Nobel Prize in Physiology or Medicine 1936 was awarded jointly to Sir Henry Hallett Dale and Otto Loewi for their discoveries relating to chemical transmission of nerve impulses
1936,peace,Carlos Saavedra Lamas,1878-11-01,Buenos Aires,Argentina,Argentina,"Foreign Minister, President of the Assembly of the League of Nations, Mediator in a conflict between Paraguay and Bolivia", Negotiation,The Nobel Peace Prize,The Nobel Peace Prize 1936 was awarded to Carlos Saavedra Lamas.
1936,physics,Carl David Anderson,1905-09-03,New York NY,USA,,"California Institute of Technology (Caltech), Pasadena, CA, USA", Particle physics,The Nobel Prize in Physics,The Nobel Prize in Physics 1936 was divided equally between Victor Franz Hess for his discovery of cosmic radiation and Carl David Anderson for his discovery of the positron.
1936,physics,Victor Franz Hess,1883-06-24,Frauenfeld,Switzerland,,"Innsbruck University, Innsbruck, Austria","Astrophysics, cosmic radiation",The Nobel Prize in Physics,The Nobel Prize in Physics 1936 was divided equally between Victor Franz Hess for his discovery of cosmic radiation and Carl David Anderson for his discovery of the positron.
1937,chemistry,Paul Karrer,1889-04-21,Moscow,Russia,,"University of Zurich, Zurich, Switzerland","Organic chemistry, natural products chemistry",The Nobel Prize in Chemistry,"The Nobel Prize in Chemistry 1937 was divided equally between Walter Norman Haworth for his investigations on carbohydrates and vitamin C and Paul Karrer for his investigations on carotenoids, flavins and vitamins A and B2."
1937,chemistry,Walter Norman Haworth,1883-03-19,Chorley,United Kingdom,,"Birmingham University, Birmingham, United Kingdom","Organic chemistry, natural products chemistry",The Nobel Prize in Chemistry,"The Nobel Prize in Chemistry 1937 was divided equally between Walter Norman Haworth for his investigations on carbohydrates and vitamin C and Paul Karrer for his investigations on carotenoids, flavins and vitamins A and B2."
1937,literature,Roger Martin du Gard,1881-03-23,Neuilly-sur-Seine,France,France,, French,The Nobel Prize in Literature,The Nobel Prize in Literature 1937 was awarded to Roger Martin du Gard for the artistic power and truth with which he has depicted human conflict as well as some fundamental aspects of contemporary life in his novel-cycle Les Thibault.
1937,medicine,Albert von Szent-Györgyi Nagyrápolt,1893-09-16,Budapest,Austria-Hungary (now Hungary),,"Szeged University, Szeged, Hungary",,The Nobel Prize in Physiology or Medicine,"The Nobel Prize in Physiology or Medicine 1937 was awarded to Albert Szent-Györgyi for his discoveries in connection with the biological combustion processes, with special reference to vitamin C and the catalysis of fumaric acid."
1937,peace,"Cecil of Chelwood, Viscount (Lord Edgar Algernon Robert Gascoyne Cecil)",1864-09-14,London,United Kingdom,United Kingdom,"Founder and President, International Peace Campaign, Writer, i.a. ex-Lord Privy Seal","World organizing, peace movement",The Nobel Peace Prize,The Nobel Peace Prize 1937 was awarded to Robert Cecil.
1937,physics,Clinton Joseph Davisson,1881-10-22,Bloomington IL,USA,,"Bell Telephone Laboratories, New York, NY, USA","Electromagnetism, christallography",The Nobel Prize in Physics,The Nobel Prize in Physics 1937 was awarded jointly to Clinton Joseph Davisson and George Paget Thomson for their experimental discovery of the diffraction of electrons by crystals
1937,physics,George Paget Thomson,1892-05-03,Cambridge,United Kingdom,,"London University, London, United Kingdom","Electromagnetism, christallography",The Nobel Prize in Physics,The Nobel Prize in Physics 1937 was awarded jointly to Clinton Joseph Davisson and George Paget Thomson for their experimental discovery of the diffraction of electrons by crystals
1938,chemistry,Richard Kuhn,1900-12-03,Vienna,Austria-Hungary,,"Kaiser-Wilhelm-Institut (now Max-Planck Institut) für Medizinische Forschung, Heidelberg, Germany, University of Heidelberg, Heidelberg, Germany","Organic chemistry, natural products chemistry",The Nobel Prize in Chemistry,The Nobel Prize in Chemistry 1938 was awarded to Richard Kuhn for his work on carotenoids and vitamins.
1938,literature,Pearl Buck,1892-06-26,Hillsboro WV,USA,USA,, English,The Nobel Prize in Literature,The Nobel Prize in Literature 1938 was awarded to Pearl Buck for her rich and truly epic descriptions of peasant life in China and for her biographical masterpieces.
1938,medicine,Corneille Jean François Heymans,1892-03-28,Ghent,Belgium,,"Ghent University, Ghent, Belgium",,The Nobel Prize in Physiology or Medicine,The Nobel Prize in Physiology or Medicine 1938 was awarded to Corneille Heymans for the discovery of the role played by the sinus and aortic mechanisms in the regulation of respiration.
1938,peace,Office international Nansen pour les Réfugiés (Nansen International Office for Refugees),1931-04-01,Geneva,Switzerland.,, An international aid organization established by Fridtjof Nansen, Humanitarian work,The Nobel Peace Prize,The Nobel Peace Prize 1938 was awarded to Nansen International Office for Refugees.
1938,physics,Enrico Fermi,1901-09-29,Rome,Italy,,"Rome University, Rome, Italy", Nuclear physics,The Nobel Prize in Physics,"The Nobel Prize in Physics 1938 was awarded to Enrico Fermi for his demonstrations of the existence of new radioactive elements produced by neutron irradiation, and for his related discovery of nuclear reactions brought about by slow neutrons."
1939,chemistry,Adolf Friedrich Johann Butenandt,1903-03-24,Bremerhaven-Lehe,Germany,,"Kaiser-Wilhelm-Institut (now Max-Planck-Institut) für Biochemie, Berlin-Dahlem, Germany, Berlin University, Berlin, Germany","Organic chemistry, natural products chemistry",The Nobel Prize in Chemistry,The Nobel Prize in Chemistry 1939 was divided equally between Adolf Friedrich Johann Butenandt for his work on sex hormones and Leopold Ruzicka for his work on polymethylenes and higher terpenes.
1939,chemistry,Leopold Ruzicka,1887-09-13,Vukovar,Austria-Hungary (now Croatia),,"Eidgenössische Technische Hochschule (Swiss Federal Institute of Technology), Zurich, Switzerland","Organic chemistry, natural products chemistry",The Nobel Prize in Chemistry,The Nobel Prize in Chemistry 1939 was divided equally between Adolf Friedrich Johann Butenandt for his work on sex hormones and Leopold Ruzicka for his work on polymethylenes and higher terpenes.
1939,literature,Frans Eemil Sillanpää,1888-09-16,Hämeenkyrö,Russian Empire (now Finland),Finland,, Finnish,The Nobel Prize in Literature,The Nobel Prize in Literature 1939 was awarded to Frans Eemil Sillanpää for his deep understanding of his country's peasantry and the exquisite art with which he has portrayed their way of life and their relationship with Nature.
1939,medicine,Gerhard Domagk,1895-10-30,Lagow,Germany,,"Munster University, Munster, Germany",,The Nobel Prize in Physiology or Medicine,The Nobel Prize in Physiology or Medicine 1939 was awarded to Gerhard Domagk for the discovery of the antibacterial effects of prontosil.
1939,physics,Ernest Orlando Lawrence,1901-08-08,Canton SD,USA,,"University of California, Berkeley, CA, USA","Accelerator physics, instrumentation",The Nobel Prize in Physics,"The Nobel Prize in Physics 1939 was awarded to Ernest Lawrence for the invention and development of the cyclotron and for results obtained with it, especially with regard to artificial radioactive elements."
1943,chemistry,George de Hevesy,1885-08-01,Budapest,Austria-Hungary (now Hungary),,"Stockholm University, Stockholm, Sweden","Inorganic chemistry, nuclear chemistry",The Nobel Prize in Chemistry,The Nobel Prize in Chemistry 1943 was awarded to George de Hevesy for his work on the use of isotopes as tracers in the study of chemical processes.
1943,medicine,Edward Adelbert Doisy,1893-11-13,Hume IL,USA,,"Saint Louis University, St. Louis, MO, USA",,The Nobel Prize in Physiology or Medicine,The Nobel Prize in Physiology or Medicine 1943 was divided equally between Henrik Carl Peter Dam for his discovery of vitamin K and Edward Adelbert Doisy for his discovery of the chemical nature of vitamin K.
1943,medicine,Henrik Carl Peter Dam,1895-02-21,Copenhagen,Denmark,,"Polytechnic Institute, Copenhagen, Denmark",,The Nobel Prize in Physiology or Medicine,The Nobel Prize in Physiology or Medicine 1943 was divided equally between Henrik Carl Peter Dam for his discovery of vitamin K and Edward Adelbert Doisy for his discovery of the chemical nature of vitamin K.
1943,physics,Otto Stern,1888-02-17,Sorau (now Zory),Germany (now Poland),,"Carnegie Institute of Technology, Pittsburgh, PA, USA", Nuclear physics,The Nobel Prize in Physics,The Nobel Prize in Physics 1943 was awarded to Otto Stern for his contribution to the development of the molecular ray method and his discovery of the magnetic moment of the proton.
1944,chemistry,Otto Hahn,1879-03-08,Frankfurt-on-the-Main,Germany,,"Kaiser-Wilhelm-Institut (now Max-Planck Institut) für Chemie, Berlin-Dahlem, Germany", Nuclear chemistry,The Nobel Prize in Chemistry,The Nobel Prize in Chemistry 1944 was awarded to Otto Hahn for his discovery of the fission of heavy nuclei.
1944,literature,Johannes Vilhelm Jensen,1873-01-20,Farsĝ,Denmark,Denmark,, Danish,The Nobel Prize in Literature,"The Nobel Prize in Literature 1944 was awarded to Johannes V. Jensen for the rare strength and fertility of his poetic imagination with which is combined an intellectual curiosity of wide scope and a bold, freshly creative style."
1944,medicine,Herbert Spencer Gasser,1888-07-05,Platteville WI,USA,,"Rockefeller Institute for Medical Research, New York, NY, USA",,The Nobel Prize in Physiology or Medicine,The Nobel Prize in Physiology or Medicine 1944 was awarded jointly to Joseph Erlanger and Herbert Spencer Gasser for their discoveries relating to the highly differentiated functions of single nerve fibres
1944,medicine,Joseph Erlanger,1874-01-05,San Francisco CA,USA,,"Washington University, St. Louis, MO, USA",,The Nobel Prize in Physiology or Medicine,The Nobel Prize in Physiology or Medicine 1944 was awarded jointly to Joseph Erlanger and Herbert Spencer Gasser for their discoveries relating to the highly differentiated functions of single nerve fibres
1944,peace,Comité international de la Croix Rouge (International Committee of the Red Cross),1863-02-17,Geneva,Switzerland,,, Humanitarian work,The Nobel Peace Prize,The Nobel Peace Prize 1944 was awarded to International Committee of the Red Cross.
1944,physics,Isidor Isaac Rabi,1898-07-29,Rymanow,Austria-Hungary (now Poland),,"Columbia University, New York, NY, USA", Nuclear physics,The Nobel Prize in Physics,The Nobel Prize in Physics 1944 was awarded to Isidor Isaac Rabi for his resonance method for recording the magnetic properties of atomic nuclei.
1945,chemistry,Artturi Ilmari Virtanen,1895-01-15,Helsinki,Russian Empire (now Finland),,"Helsinki University, Helsinki, Finland", Agricultural chemistry,The Nobel Prize in Chemistry,"The Nobel Prize in Chemistry 1945 was awarded to Artturi Virtanen for his research and inventions in agricultural and nutrition chemistry, especially for his fodder preservation method."
1945,literature,Gabriela Mistral,1889-04-07,Vicuña,Chile,Chile,, Spanish,The Nobel Prize in Literature,"The Nobel Prize in Literature 1945 was awarded to Gabriela Mistral for her lyric poetry which, inspired by powerful emotions, has made her name a symbol of the idealistic aspirations of the entire Latin American world."
1945,medicine,Ernst Boris Chain,1906-06-19,Berlin,Germany,,"University of Oxford, Oxford, United Kingdom",,The Nobel Prize in Physiology or Medicine,"The Nobel Prize in Physiology or Medicine 1945 was awarded jointly to Sir Alexander Fleming, Ernst Boris Chain and Sir Howard Walter Florey for the discovery of penicillin and its curative effect in various infectious diseases."
1945,medicine,Sir Alexander Fleming,1881-08-06,Lochfield,Scotland,,"London University, London, United Kingdom",,The Nobel Prize in Physiology or Medicine,"The Nobel Prize in Physiology or Medicine 1945 was awarded jointly to Sir Alexander Fleming, Ernst Boris Chain and Sir Howard Walter Florey for the discovery of penicillin and its curative effect in various infectious diseases."
1945,medicine,Sir Howard Walter Florey,1898-09-24,Adelaide,Australia,,"University of Oxford, Oxford, United Kingdom",,The Nobel Prize in Physiology or Medicine,"The Nobel Prize in Physiology or Medicine 1945 was awarded jointly to Sir Alexander Fleming, Ernst Boris Chain and Sir Howard Walter Florey for the discovery of penicillin and its curative effect in various infectious diseases."
1945,peace,Cordell Hull,1871-10-02,Olympus TN,USA,USA,"Prominent participant in the originating of the United Nations, ex-Secretary of State", World organizing,The Nobel Peace Prize,The Nobel Peace Prize 1945 was awarded to Cordell Hull.
1945,physics,Wolfgang Pauli,1900-04-25,Vienna,Austria,,"Princeton University, Princeton, NJ, USA", Quantum mechanics,The Nobel Prize in Physics,"The Nobel Prize in Physics 1945 was awarded to Wolfgang Pauli for the discovery of the Exclusion Principle, also called the Pauli Principle."
