Year,Category,Name,Birthdate,Birth Place,County,Residence,Role/Affiliate,Field/Language,Prize Name,Motivation
1901,chemistry,Jacobus Henricus van 't Hoff,1852-08-30,Rotterdam,the Netherlands,,"Berlin University, Berlin, Germany","Physical chemistry, chemical kinetics",The Nobel Prize in Chemistry,The Nobel Prize in Chemistry 1901 was awarded to Jacobus H. van 't Hoff in recognition of the extraordinary services he has rendered by the discovery of the laws of chemical dynamics and osmotic pressure in solutions.
1901,literature,Sully Prudhomme,1839-03-16,Paris,France,France,, French,The Nobel Prize in Literature,"The Nobel Prize in Literature 1901 was awarded to Sully Prudhomme in special recognition of his poetic composition, which gives evidence of lofty idealism, artistic perfection and a rare combination of the qualities of both heart and intellect."
1901,medicine,Emil Adolf von Behring,1854-03-15,Hansdorf (now Ławice),Prussia (now Poland),,"Marburg University, Marburg, Germany",,The Nobel Prize in Physiology or Medicine,"The Nobel Prize in Physiology or Medicine 1901 was awarded to Emil von Behring for his work on serum therapy, especially its application against diphtheria, by which he has opened a new road in the domain of medical science and thereby placed in the hands of the physician a victorious weapon against illness and deaths."
1901,peace,Frédéric Passy,1822-05-20,Paris,France,France, Founder and President of first French peace society (since 1889 called Société française pour l'arbitrage entre nations),"Humanitarian work, peace movement",The Nobel Peace Prize,The Nobel Peace Prize 1901 was awarded jointly to Jean Henry Dunant and Frédéric Passy
1901,peace,Jean Henry Dunant,1828-05-08,Geneva,Switzerland,Switzerland,"Originator Geneva Convention (Convention de Genève), Founder of the International Committee of the Red Cross, Geneva","Humanitarian work, peace movement",The Nobel Peace Prize,The Nobel Peace Prize 1901 was awarded jointly to Jean Henry Dunant and Frédéric Passy
1901,physics,Wilhelm Conrad Röntgen,1845-03-27,Lennep (now Remscheid),Prussia (now Germany),,"Munich University, Munich, Germany","X-rays, atomic physics",The Nobel Prize in Physics,The Nobel Prize in Physics 1901 was awarded to Wilhelm Conrad Röntgen in recognition of the extraordinary services he has rendered by the discovery of the remarkable rays subsequently named after him.
1902,chemistry,Hermann Emil Fischer,1852-10-09,Euskirchen,Prussia (now Germany),,"Berlin University, Berlin, Germany", Organic chemistry,The Nobel Prize in Chemistry,The Nobel Prize in Chemistry 1902 was awarded to Emil Fischer in recognition of the extraordinary services he has rendered by his work on sugar and purine syntheses.
1902,literature,Christian Matthias Theodor Mommsen,1817-11-30,Garding,Schleswig (now Germany),Germany,, German,The Nobel Prize in Literature,"The Nobel Prize in Literature 1902 was awarded to Theodor Mommsen the greatest living master of the art of historical writing, with special reference to his monumental work, A history of Rome."
1902,medicine,Ronald Ross,1857-05-13,Almora,India,,"University College, Liverpool, United Kingdom",,The Nobel Prize in Physiology or Medicine,"The Nobel Prize in Physiology or Medicine 1902 was awarded to Ronald Ross for his work on malaria, by which he has shown how it enters the organism and thereby has laid the foundation for successful research on this disease and methods of combating it."
1902,peace,Charles Albert Gobat,1843-05-21,Tramelan,Switzerland,Switzerland,"Honorary Secretary, Permanent International Peace Bureau, Bern, Switzerland, Secretary General, Inter-Parliamentary Union", Peace movement,The Nobel Peace Prize,The Nobel Peace Prize 1902 was awarded jointly to Élie Ducommun and Charles Albert Gobat
1902,peace,Élie Ducommun,1833-02-19,Geneva,Switzerland,Switzerland,"Honorary Secretary, Permanent International Peace Bureau, Bern, Switzerland", Peace movement,The Nobel Peace Prize,The Nobel Peace Prize 1902 was awarded jointly to Élie Ducommun and Charles Albert Gobat
1902,physics,Hendrik Antoon Lorentz,1853-07-18,Arnhem,the Netherlands,,"Leiden University, Leiden, the Netherlands","Atomic physics, quantum physics",The Nobel Prize in Physics,The Nobel Prize in Physics 1902 was awarded jointly to Hendrik Antoon Lorentz and Pieter Zeeman in recognition of the extraordinary service they rendered by their researches into the influence of magnetism upon radiation phenomena
1902,physics,Pieter Zeeman,1865-05-25,Zonnemaire,the Netherlands,,"Amsterdam University, Amsterdam, the Netherlands","Atomic physics, quantum physics",The Nobel Prize in Physics,The Nobel Prize in Physics 1902 was awarded jointly to Hendrik Antoon Lorentz and Pieter Zeeman in recognition of the extraordinary service they rendered by their researches into the influence of magnetism upon radiation phenomena
1903,chemistry,Svante August Arrhenius,1859-02-19,Vik,Sweden,,"Stockholm University, Stockholm, Sweden","Physical chemistry, chemical kinetics",The Nobel Prize in Chemistry,The Nobel Prize in Chemistry 1903 was awarded to Svante Arrhenius in recognition of the extraordinary services he has rendered to the advancement of chemistry by his electrolytic theory of dissociation.
1903,literature,Bjĝrnstjerne Martinus Bjĝrnson,1832-12-08,Kvikne,Norway,Norway,, Norwegian,The Nobel Prize in Literature,"The Nobel Prize in Literature 1903 was awarded to Bjĝrnstjerne Bjĝrnson as a tribute to his noble, magnificent and versatile poetry, which has always been distinguished by both the freshness of its inspiration and the rare purity of its spirit."
1903,medicine,Niels Ryberg Finsen,1860-12-15,Thorshavn,Faroe Islands,,"Finsen Medical Light Institute, Copenhagen, Denmark",,The Nobel Prize in Physiology or Medicine,"The Nobel Prize in Physiology or Medicine 1903 was awarded to Niels Ryberg Finsen in recognition of his contribution to the treatment of diseases, especially lupus vulgaris, with concentrated light radiation, whereby he has opened a new avenue for medical science."
1903,peace,William Randal Cremer,1828-03-18,Fareham,United Kingdom,United Kingdom,"Secretary, International Arbitration League, Member, British Parliament","Peace movement, world organizing",The Nobel Peace Prize,The Nobel Peace Prize 1903 was awarded to Randal Cremer.
1903,physics,Antoine Henri Becquerel,1852-12-15,Paris,France,,"École Polytechnique, Paris, France", Nuclear physics,The Nobel Prize in Physics,"The Nobel Prize in Physics 1903 was divided, one half awarded to Antoine Henri Becquerel in recognition of the extraordinary services he has rendered by his discovery of spontaneous radioactivity,the other half jointly to Pierre Curie and Marie Curie, née Sklodowska in recognition of the extraordinary services they have rendered by their joint researches on the radiation phenomena discovered by Professor Henri Becquerel."
1903,physics,"Marie Curie, née Sklodowska",1867-11-07,Warsaw,Russian Empire (now Poland),,, Nuclear physics,The Nobel Prize in Physics,"The Nobel Prize in Physics 1903 was divided, one half awarded to Antoine Henri Becquerel in recognition of the extraordinary services he has rendered by his discovery of spontaneous radioactivity,the other half jointly to Pierre Curie and Marie Curie, née Sklodowska in recognition of the extraordinary services they have rendered by their joint researches on the radiation phenomena discovered by Professor Henri Becquerel."
1903,physics,Pierre Curie,1859-05-15,Paris,France,,"École municipale de physique et de chimie industrielles (Municipal School of Industrial Physics and Chemistry), Paris, France", Nuclear physics,The Nobel Prize in Physics,"The Nobel Prize in Physics 1903 was divided, one half awarded to Antoine Henri Becquerel in recognition of the extraordinary services he has rendered by his discovery of spontaneous radioactivity,the other half jointly to Pierre Curie and Marie Curie, née Sklodowska in recognition of the extraordinary services they have rendered by their joint researches on the radiation phenomena discovered by Professor Henri Becquerel."
1904,chemistry,Sir William Ramsay,1852-10-02,Glasgow,Scotland,,"University College, London, United Kingdom","Inorganic chemistry, nuclear chemistry",The Nobel Prize in Chemistry,"The Nobel Prize in Chemistry 1904 was awarded to Sir William Ramsay in recognition of his services in the discovery of the inert gaseous elements in air, and his determination of their place in the periodic system."
1904,literature,Frédéric Mistral,1830-09-08,Maillane,France,France,, Occitan,The Nobel Prize in Literature,"The Nobel Prize in Literature 1904 was divided equally between Frédéric Mistral in recognition of the fresh originality and true inspiration of his poetic production, which faithfully reflects the natural scenery and native spirit of his people, and, in addition, his significant work as a Provençal philologist and José Echegaray y Eizaguirre in recognition of the numerous and brilliant compositions which, in an individual and original manner, have revived the great traditions of the Spanish drama."
1904,literature,José Echegaray y Eizaguirre,1832-04-19,Madrid,Spain,Spain,, Spanish,The Nobel Prize in Literature,"The Nobel Prize in Literature 1904 was divided equally between Frédéric Mistral in recognition of the fresh originality and true inspiration of his poetic production, which faithfully reflects the natural scenery and native spirit of his people, and, in addition, his significant work as a Provençal philologist and José Echegaray y Eizaguirre in recognition of the numerous and brilliant compositions which, in an individual and original manner, have revived the great traditions of the Spanish drama."
1904,medicine,Ivan Petrovich Pavlov,1849-09-14,Ryazan,Russia,,"Military Medical Academy, St. Petersburg, Russia",,The Nobel Prize in Physiology or Medicine,"The Nobel Prize in Physiology or Medicine 1904 was awarded to Ivan Pavlov in recognition of his work on the physiology of digestion, through which knowledge on vital aspects of the subject has been transformed and enlarged."
1904,peace,Institut de droit international (Institute of International Law),1873-09-03,Ghent,Belgium,, Scientific society,"Peace movement, world organizing",The Nobel Peace Prize,The Nobel Peace Prize 1904 was awarded to Institute of International Law.
1904,physics,Lord Rayleigh (John William Strutt),1842-11-12,Langford Grove Maldon Essex,United Kingdom,,"Royal Institution of Great Britain, London, United Kingdom","Gas physics, molecular physics",The Nobel Prize in Physics,The Nobel Prize in Physics 1904 was awarded to Lord Rayleigh for his investigations of the densities of the most important gases and for his discovery of argon in connection with these studies.
1905,chemistry,Johann Friedrich Wilhelm Adolf von Baeyer,1835-10-31,Berlin,Prussia (now Germany),,"Munich University, Munich, Germany","Organic chemistry, industrial chemistry",The Nobel Prize in Chemistry,"The Nobel Prize in Chemistry 1905 was awarded to Adolf von Baeyer in recognition of his services in the advancement of organic chemistry and the chemical industry, through his work on organic dyes and hydroaromatic compounds."
1905,literature,Henryk Sienkiewicz,1846-05-05,Wola Okrzejska,Poland,Poland,, Polish,The Nobel Prize in Literature,The Nobel Prize in Literature 1905 was awarded to Henryk Sienkiewicz because of his outstanding merits as an epic writer.
1905,medicine,Robert Koch,1843-12-11,Clausthal (now Clausthal-Zellerfeld),Germany,,"Institute for Infectious Diseases, Berlin, Germany",,The Nobel Prize in Physiology or Medicine,The Nobel Prize in Physiology or Medicine 1905 was awarded to Robert Koch for his investigations and discoveries in relation to tuberculosis.
1905,peace,"Baroness Bertha Sophie Felicita von Suttner, née Countess Kinsky von Chinic und Tettau",1843-06-09,Prague,Austrian Empire (now Czech Republic),Austria,"Author of <i>Lay Down Your Arms</i>, Honorary President of Permanent International Peace Bureau, Berne, Switzerland", Peace movement,The Nobel Peace Prize,The Nobel Peace Prize 1905 was awarded to Bertha von Suttner.
1905,physics,Philipp Eduard Anton von Lenard,1862-06-07,Pressburg (now Bratislava),Hungary (now Slovakia),,"Kiel University, Kiel, Germany", Atomic physics,The Nobel Prize in Physics,The Nobel Prize in Physics 1905 was awarded to Philipp Lenard for his work on cathode rays.
1906,chemistry,Henri Moissan,1852-09-28,Paris,France,,"Sorbonne University, Paris, France","Inorganic chemistry, nuclear chemistry",The Nobel Prize in Chemistry,"The Nobel Prize in Chemistry 1906 was awarded to Henri Moissan in recognition of the great services rendered by him in his investigation and isolation of the element fluorine, and for the adoption in the service of science of the electric furnace called after him."
1906,literature,Giosuè Carducci,1835-07-27,Val di Castello,Tuscany (now Italy),Italy,, Italian,The Nobel Prize in Literature,"The Nobel Prize in Literature 1906 was awarded to Giosuè Carducci not only in consideration of his deep learning and critical research, but above all as a tribute to the creative energy, freshness of style, and lyrical force which characterize his poetic masterpieces."
1906,medicine,Camillo Golgi,1843-07-07,Corteno,Italy,,"Pavia University, Pavia, Italy",,The Nobel Prize in Physiology or Medicine,The Nobel Prize in Physiology or Medicine 1906 was awarded jointly to Camillo Golgi and Santiago Ramón y Cajal in recognition of their work on the structure of the nervous system
1906,medicine,Santiago Ramón y Cajal,1852-05-01,Petilla de Aragó,Spain,,"Madrid University, Madrid, Spain",,The Nobel Prize in Physiology or Medicine,The Nobel Prize in Physiology or Medicine 1906 was awarded jointly to Camillo Golgi and Santiago Ramón y Cajal in recognition of their work on the structure of the nervous system
1906,peace,Theodore Roosevelt,1858-10-27,New York NY,USA,USA,"Collaborator of various peace treaties, President of United States of America", Negotiation,The Nobel Peace Prize,The Nobel Peace Prize 1906 was awarded to Theodore Roosevelt.
1906,physics,Joseph John Thomson,1856-12-18,Cheetham Hill near Manchester,United Kingdom,,"University of Cambridge, Cambridge, United Kingdom", Atomic physics,The Nobel Prize in Physics,The Nobel Prize in Physics 1906 was awarded to J.J. Thomson in recognition of the great merits of his theoretical and experimental investigations on the conduction of electricity by gases.
1907,chemistry,Eduard Buchner,1860-05-20,Munich,Bavaria (now Germany),,"Landwirtschaftliche Hochschule (Agricultural College), Berlin, Germany", Biochemistry,The Nobel Prize in Chemistry,The Nobel Prize in Chemistry 1907 was awarded to Eduard Buchner for his biochemical researches and his discovery of cell-free fermentation.
1907,literature,Rudyard Kipling,1865-12-30,Bombay,British India,United Kingdom,, English,The Nobel Prize in Literature,"The Nobel Prize in Literature 1907 was awarded to Rudyard Kipling in consideration of the power of observation, originality of imagination, virility of ideas and remarkable talent for narration which characterize the creations of this world-famous author."
1907,medicine,Charles Louis Alphonse Laveran,1845-06-18,Paris,France,,"Institut Pasteur, Paris, France",,The Nobel Prize in Physiology or Medicine,The Nobel Prize in Physiology or Medicine 1907 was awarded to Alphonse Laveran in recognition of his work on the role played by protozoa in causing diseases.
1907,peace,Ernesto Teodoro Moneta,1833-09-20,Milan,Austrian Empire (now Italy),Italy,"President, Lombard League of Peace","Peace movement, world organizing",The Nobel Peace Prize,The Nobel Peace Prize 1907 was awarded jointly to Ernesto Teodoro Moneta and Louis Renault
1907,peace,Louis Renault,1843-05-21,Autun,France,France, Professor International Law,"Peace movement, world organizing",The Nobel Peace Prize,The Nobel Peace Prize 1907 was awarded jointly to Ernesto Teodoro Moneta and Louis Renault
1907,physics,Albert Abraham Michelson,1852-12-19,Strelno (now Strzelno),Prussia (now Poland),,"University of Chicago, Chicago, IL, USA","Optical physics, electromagnetism",The Nobel Prize in Physics,The Nobel Prize in Physics 1907 was awarded to Albert A. Michelson for his optical precision instruments and the spectroscopic and metrological investigations carried out with their aid.
1908,chemistry,Ernest Rutherford,1871-08-31,Nelson,New Zealand,,"Victoria University, Manchester, United Kingdom", Nuclear chemistry,The Nobel Prize in Chemistry,"The Nobel Prize in Chemistry 1908 was awarded to Ernest Rutherford for his investigations into the disintegration of the elements, and the chemistry of radioactive substances."
1908,literature,Rudolf Christoph Eucken,1846-01-05,Aurich,East Friesland (now Germany),Germany,, German,The Nobel Prize in Literature,"The Nobel Prize in Literature 1908 was awarded to Rudolf Eucken in recognition of his earnest search for truth, his penetrating power of thought, his wide range of vision, and the warmth and strength in presentation with which in his numerous works he has vindicated and developed an idealistic philosophy of life."
1908,medicine,Ilya Ilyich Mechnikov,1845-05-16,Kharkov (now Kharkiv),Russian Empire (now Ukraine),,"Institut Pasteur, Paris, France",,The Nobel Prize in Physiology or Medicine,The Nobel Prize in Physiology or Medicine 1908 was awarded jointly to Ilya Ilyich Mechnikov and Paul Ehrlich in recognition of their work on immunity
1908,medicine,Paul Ehrlich,1854-03-14,Strehlen (now Strzelin),Prussia (now Poland),,"Goettingen University, Goettingen, Germany, Königliches Institut für experimentelle Therapie (Royal Institute for Experimental Therapy), Frankfurt-on-the-Main, Germany",,The Nobel Prize in Physiology or Medicine,The Nobel Prize in Physiology or Medicine 1908 was awarded jointly to Ilya Ilyich Mechnikov and Paul Ehrlich in recognition of their work on immunity
1908,peace,Fredrik Bajer,1837-04-21,Nĉstved,Denmark,Denmark,"Honorary President of Permanent International Peace Bureau, Berne, Switzerland, Member, Danish Parliament", Peace movement,The Nobel Peace Prize,The Nobel Peace Prize 1908 was awarded jointly to Klas Pontus Arnoldson and Fredrik Bajer
1908,peace,Klas Pontus Arnoldson,1844-10-27,Gothenburg,Sweden,Sweden,"Founder of Swedish Peace and Arbitration League, Formerly Member of Swedish Parliament, Writer", Peace movement,The Nobel Peace Prize,The Nobel Peace Prize 1908 was awarded jointly to Klas Pontus Arnoldson and Fredrik Bajer
1908,physics,Gabriel Lippmann,1845-08-16,Hollerich,Luxembourg,,"Sorbonne University, Paris, France","Optical physics, applied optical physics",The Nobel Prize in Physics,The Nobel Prize in Physics 1908 was awarded to Gabriel Lippmann for his method of reproducing colours photographically based on the phenomenon of interference.
1909,chemistry,Wilhelm Ostwald,1853-09-02,Riga Latvia,Russian Empire,,"Leipzig University, Leipzig, Germany", Physical chemistry,The Nobel Prize in Chemistry,The Nobel Prize in Chemistry 1909 was awarded to Wilhelm Ostwald in recognition of his work on catalysis and for his investigations into the fundamental principles governing chemical equilibria and rates of reaction.
1909,literature,Selma Ottilia Lovisa Lagerlöf,1858-11-20,Mċrbacka,Sweden,Sweden,, Swedish,The Nobel Prize in Literature,"The Nobel Prize in Literature 1909 was awarded to Selma Lagerlöf in appreciation of the lofty idealism, vivid imagination and spiritual perception that characterize her writings."
1909,medicine,Emil Theodor Kocher,1841-08-25,Berne,Switzerland,,"Berne University, Berne, Switzerland",,The Nobel Prize in Physiology or Medicine,"The Nobel Prize in Physiology or Medicine 1909 was awarded to Theodor Kocher for his work on the physiology, pathology and surgery of the thyroid gland."
1909,peace,Auguste Marie François Beernaert,1829-07-26,Ostend,Belgium,Belgium,"Member of Cour Internationale d'arbitrage at the Hague, Member, Belgian Parliament, ex-Prime Minister","Peace movement, world organizing",The Nobel Peace Prize,"The Nobel Peace Prize 1909 was awarded jointly to Auguste Marie François Beernaert and Paul Henri Benjamin Balluet d'Estournelles de Constant, Baron de Constant de Rebecque"
1909,physics,Guglielmo Marconi,1874-04-25,Bologna,Italy,,"Marconi Wireless Telegraph Co. Ltd., London, United Kingdom","Electromagnetism, applied electromagnetism",The Nobel Prize in Physics,The Nobel Prize in Physics 1909 was awarded jointly to Guglielmo Marconi and Karl Ferdinand Braun in recognition of their contributions to the development of wireless telegraphy
1909,physics,Karl Ferdinand Braun,1850-06-06,Fulda,Hesse-Kassel (now Germany),,"Strasbourg University, Strasbourg, Alsace, then Germany","Electromagnetism, applied electromagnetism",The Nobel Prize in Physics,The Nobel Prize in Physics 1909 was awarded jointly to Guglielmo Marconi and Karl Ferdinand Braun in recognition of their contributions to the development of wireless telegraphy
1910,chemistry,Otto Wallach,1847-03-27,Koenigsberg (now Kaliningrad),Germany (now Russia),,"Goettingen University, Goettingen, Germany","Organic chemistry, industrial chemistry",The Nobel Prize in Chemistry,The Nobel Prize in Chemistry 1910 was awarded to Otto Wallach in recognition of his services to organic chemistry and the chemical industry by his pioneer work in the field of alicyclic compounds.
1910,literature,Paul Johann Ludwig Heyse,1830-03-15,Berlin,Prussia (now Germany),Germany,, German,The Nobel Prize in Literature,"The Nobel Prize in Literature 1910 was awarded to Paul Heyse as a tribute to the consummate artistry, permeated with idealism, which he has demonstrated during his long productive career as a lyric poet, dramatist, novelist and writer of world-renowned short stories."
1910,medicine,Albrecht Kossel,1853-09-16,Rostock,Mecklenburg (now Germany),,"University of Heidelberg, Heidelberg, Germany",,The Nobel Prize in Physiology or Medicine,"The Nobel Prize in Physiology or Medicine 1910 was awarded to Albrecht Kossel in recognition of the contributions to our knowledge of cell chemistry made through his work on proteins, including the nucleic substances."
1910,peace,Bureau international permanent de la Paix (Permanent International Peace Bureau),1891-12-01,Berne,Switzerland,,, Peace movement,The Nobel Peace Prize,The Nobel Peace Prize 1910 was awarded to Permanent International Peace Bureau.
1910,physics,Johannes Diderik van der Waals,1837-11-23,Leiden,the Netherlands,,"Amsterdam University, Amsterdam, the Netherlands","Gas physics, molecular physics",The Nobel Prize in Physics,The Nobel Prize in Physics 1910 was awarded to Johannes Diderik van der Waals for his work on the equation of state for gases and liquids.
1911,chemistry,"Marie Curie, née Sklodowska",1867-11-07,Warsaw,Russian Empire (now Poland),,"Sorbonne University, Paris, France", Nuclear chemistry,The Nobel Prize in Chemistry,"The Nobel Prize in Chemistry 1911 was awarded to Marie Curie in recognition of her services to the advancement of chemistry by the discovery of the elements radium and polonium, by the isolation of radium and the study of the nature and compounds of this remarkable element."
1911,literature,Count Maurice (Mooris) Polidore Marie Bernhard Maeterlinck,1862-08-29,Ghent,Belgium,Belgium,, French,The Nobel Prize in Literature,"The Nobel Prize in Literature 1911 was awarded to Maurice Maeterlinck in appreciation of his many-sided literary activities, and especially of his dramatic works, which are distinguished by a wealth of imagination and by a poetic fancy, which reveals, sometimes in the guise of a fairy tale, a deep inspiration, while in a mysterious way they appeal to the readers' own feelings and stimulate their imaginations."
1911,medicine,Allvar Gullstrand,1862-06-05,Landskrona,Sweden,,"Uppsala University, Uppsala, Sweden",,The Nobel Prize in Physiology or Medicine,The Nobel Prize in Physiology or Medicine 1911 was awarded to Allvar Gullstrand for his work on the dioptrics of the eye.
1911,peace,Alfred Hermann Fried,1864-11-11,Vienna,Austria,Austria,"Founder of <i>Die Friedenswarte</i> (a peace publication), Journalist",,The Nobel Peace Prize,The Nobel Peace Prize 1911 was awarded jointly to Tobias Michael Carel Asser and Alfred Hermann Fried
1911,peace,Tobias Michael Carel Asser,1838-04-28,Amsterdam,the Netherlands,the Netherlands,"Lawyer, Cabinet Minister, Initiator of the Conferences on International Private Law at the Hague", Peace movement,The Nobel Peace Prize,The Nobel Peace Prize 1911 was awarded jointly to Tobias Michael Carel Asser and Alfred Hermann Fried
1911,physics,Wilhelm Wien,1864-01-13,Gaffken (now Parusnoye),Prussia (now Russia),,"Würzburg University, Würzburg, Germany", Electromagnetism,The Nobel Prize in Physics,The Nobel Prize in Physics 1911 was awarded to Wilhelm Wien for his discoveries regarding the laws governing the radiation of heat.
1912,chemistry,Paul Sabatier,1854-11-05,Carcassonne,France,,"Toulouse University, Toulouse, France", Organic chemistry,The Nobel Prize in Chemistry,"The Nobel Prize in Chemistry 1912 was divided equally between Victor Grignard for the discovery of the so-called Grignard reagent, which in recent years has greatly advanced the progress of organic chemistry and Paul Sabatier for his method of hydrogenating organic compounds in the presence of finely disintegrated metals whereby the progress of organic chemistry has been greatly advanced in recent years."
