Year,Category,Name,Birthdate,Birth Place,County,Residence,Role/Affiliate,Field/Language,Prize Name,Motivation
1985,medicine,Joseph L. Goldstein,1940-04-18,Sumter SC,USA,,"University of Texas Southwestern Medical Center at Dallas, Dallas, TX, USA",,The Nobel Prize in Physiology or Medicine,The Nobel Prize in Physiology or Medicine 1985 was awarded jointly to Michael S. Brown and Joseph L. Goldstein for their discoveries concerning the regulation of cholesterol metabolism
1985,medicine,Michael S. Brown,1941-04-13,New York NY,USA,,"University of Texas Southwestern Medical Center at Dallas, Dallas, TX, USA",,The Nobel Prize in Physiology or Medicine,The Nobel Prize in Physiology or Medicine 1985 was awarded jointly to Michael S. Brown and Joseph L. Goldstein for their discoveries concerning the regulation of cholesterol metabolism
1985,peace,International Physicians for the Prevention of Nuclear War,1980-12-01,"Boston, MA",USA,,, Arms control and disarmament,The Nobel Peace Prize,The Nobel Peace Prize 1985 was awarded to International Physicians for the Prevention of Nuclear War.
1985,physics,Klaus von Klitzing,1943-06-28,Schroda,German-occupied Poland,,"Max-Planck-Institut für Festkörperforschung, Stuttgart, Federal Republic of Germany", Condensed matter physics,The Nobel Prize in Physics,The Nobel Prize in Physics 1985 was awarded to Klaus von Klitzing for the discovery of the quantized Hall effect.
1986,chemistry,Dudley R. Herschbach,1932-06-18,San José CA,USA,,"Harvard University, Cambridge, MA, USA","Physical chemistry, chemical kinetics",The Nobel Prize in Chemistry,"The Nobel Prize in Chemistry 1986 was awarded jointly to Dudley R. Herschbach, Yuan T. Lee and John C. Polanyi for their contributions concerning the dynamics of chemical elementary processes."
1986,chemistry,John C. Polanyi,1929-01-23,Berlin,Germany,,"University of Toronto, Toronto, Canada","Physical chemistry, chemical kinetics",The Nobel Prize in Chemistry,"The Nobel Prize in Chemistry 1986 was awarded jointly to Dudley R. Herschbach, Yuan T. Lee and John C. Polanyi for their contributions concerning the dynamics of chemical elementary processes."
1986,chemistry,Yuan T. Lee,1936-11-19,Hsinchu,Taiwan,,"University of California, Berkeley, CA, USA","Physical chemistry, chemical kinetics",The Nobel Prize in Chemistry,"The Nobel Prize in Chemistry 1986 was awarded jointly to Dudley R. Herschbach, Yuan T. Lee and John C. Polanyi for their contributions concerning the dynamics of chemical elementary processes."
1986,economics,James M. Buchanan Jr.,1919-10-03,Murfreesboro TN,USA,,"Center for Study of Public Choice, Fairfax, VA, USA", Public finance,The Prize in Economic Sciences,The Sveriges Riksbank Prize in Economic Sciences in Memory of Alfred Nobel 1986 was awarded to James M. Buchanan Jr. for his development of the contractual and constitutional bases for the theory of economic and political decision-making.
1986,literature,Wole Soyinka,1934-07-13,Abeokuta,Nigeria,Nigeria,, English,The Nobel Prize in Literature,The Nobel Prize in Literature 1986 was awarded to Wole Soyinka who in a wide cultural perspective and with poetic overtones fashions the drama of existence.
1986,medicine,Rita Levi-Montalcini,1909-04-22,Turin,Italy,,"Institute of Cell Biology of the C.N.R, Rome, Italy",,The Nobel Prize in Physiology or Medicine,The Nobel Prize in Physiology or Medicine 1986 was awarded jointly to Stanley Cohen and Rita Levi-Montalcini for their discoveries of growth factors
1986,medicine,Stanley Cohen,1922-11-17,Brooklyn NY,USA,,"Vanderbilt University School of Medicine, Nashville, TN, USA",,The Nobel Prize in Physiology or Medicine,The Nobel Prize in Physiology or Medicine 1986 was awarded jointly to Stanley Cohen and Rita Levi-Montalcini for their discoveries of growth factors
1986,peace,Elie Wiesel,1928-09-30,Sighet,Romania,USA, Chairman of The President's Commission on the Holocaust,"Human rights, humanitarian work",The Nobel Peace Prize,The Nobel Peace Prize 1986 was awarded to Elie Wiesel.
1986,physics,Ernst Ruska,1906-12-25,Heidelberg,Germany,,"Fritz-Haber-Institut der Max-Planck-Gesellschaft, Berlin, Federal Republic of Germany","Electron optics, instrumentation",The Nobel Prize in Physics,"The Nobel Prize in Physics 1986 was divided, one half awarded to Ernst Ruska for his fundamental work in electron optics, and for the design of the first electron microscope,the other half jointly to Gerd Binnig and Heinrich Rohrer for their design of the scanning tunneling microscope."
1986,physics,Gerd Binnig,1947-07-20,Frankfurt-on-the-Main,West Germany,,"IBM Zurich Research Laboratory, Rüschlikon, Switzerland","Condensed matter physics, instrumentation",The Nobel Prize in Physics,"The Nobel Prize in Physics 1986 was divided, one half awarded to Ernst Ruska for his fundamental work in electron optics, and for the design of the first electron microscope,the other half jointly to Gerd Binnig and Heinrich Rohrer for their design of the scanning tunneling microscope."
1986,physics,Heinrich Rohrer,1933-06-06,Buchs,Switzerland,,"IBM Zurich Research Laboratory, Rüschlikon, Switzerland","Condensed matter physics, instrumentation",The Nobel Prize in Physics,"The Nobel Prize in Physics 1986 was divided, one half awarded to Ernst Ruska for his fundamental work in electron optics, and for the design of the first electron microscope,the other half jointly to Gerd Binnig and Heinrich Rohrer for their design of the scanning tunneling microscope."
1987,chemistry,Charles J. Pedersen,1904-10-03,Pusan,Korea,,"Du Pont, Wilmington, DE, USA", Organic chemistry,The Nobel Prize in Chemistry,"The Nobel Prize in Chemistry 1987 was awarded jointly to Donald J. Cram, Jean-Marie Lehn and Charles J. Pedersen for their development and use of molecules with structure-specific interactions of high selectivity."
1987,chemistry,Donald J. Cram,1919-04-22,Chester VT,USA,,"University of California, Los Angeles, CA, USA", Organic chemistry,The Nobel Prize in Chemistry,"The Nobel Prize in Chemistry 1987 was awarded jointly to Donald J. Cram, Jean-Marie Lehn and Charles J. Pedersen for their development and use of molecules with structure-specific interactions of high selectivity."
1987,chemistry,Jean-Marie Lehn,1939-09-30,Rosheim,France,,"Université Louis Pasteur, Strasbourg, France, Collège de France, Paris, France", Organic chemistry,The Nobel Prize in Chemistry,"The Nobel Prize in Chemistry 1987 was awarded jointly to Donald J. Cram, Jean-Marie Lehn and Charles J. Pedersen for their development and use of molecules with structure-specific interactions of high selectivity."
1987,economics,Robert M. Solow,1924-08-23,Brooklyn NY,USA,,"Massachusetts Institute of Technology (MIT), Cambridge, MA, USA", Economic growth theory,The Prize in Economic Sciences,The Sveriges Riksbank Prize in Economic Sciences in Memory of Alfred Nobel 1987 was awarded to Robert M. Solow for his contributions to the theory of economic growth.
1987,literature,Joseph Brodsky,1940-05-24,Leningrad (now Saint Petersburg),USSR (now Russia),USA,, English (prose) and Russian (poetry),The Nobel Prize in Literature,"The Nobel Prize in Literature 1987 was awarded to Joseph Brodsky for an all-embracing authorship, imbued with clarity of thought and poetic intensity."
1987,medicine,Susumu Tonegawa,1939-09-06,Nagoya,Japan,,"Massachusetts Institute of Technology (MIT), Cambridge, MA, USA",,The Nobel Prize in Physiology or Medicine,The Nobel Prize in Physiology or Medicine 1987 was awarded to Susumu Tonegawa for his discovery of the genetic principle for generation of antibody diversity.
1987,peace,Oscar Arias Sánchez,1941-09-13,Heredia,Costa Rica,Costa Rica, President of Costa Rica, Negotiation,The Nobel Peace Prize,"The Nobel Peace Prize 1987 was awarded to Oscar Arias Sánchez for his work for peace in Central America, efforts which led to the accord signed in Guatemala on August 7 this year."
1987,physics,J. Georg Bednorz,1950-05-16,Neuenkirchen,West Germany,,"IBM Zurich Research Laboratory, Rüschlikon, Switzerland", Superconductivity,The Nobel Prize in Physics,The Nobel Prize in Physics 1987 was awarded jointly to J. Georg Bednorz and K. Alexander Müller for their important break-through in the discovery of superconductivity in ceramic materials
1987,physics,K. Alexander Müller,2027-04-20,Basel,Switzerland,,"IBM Zurich Research Laboratory, Rüschlikon, Switzerland", Superconductivity,The Nobel Prize in Physics,The Nobel Prize in Physics 1987 was awarded jointly to J. Georg Bednorz and K. Alexander Müller for their important break-through in the discovery of superconductivity in ceramic materials
1988,chemistry,Hartmut Michel,1948-07-18,Ludwigsburg,West Germany,,"Max-Planck-Institut für Biophysik, Frankfurt-on-the-Main, Federal Republic of Germany","Biochemistry, structural chemistry",The Nobel Prize in Chemistry,"The Nobel Prize in Chemistry 1988 was awarded jointly to Johann Deisenhofer, Robert Huber and Hartmut Michel for the determination of the three-dimensional structure of a photosynthetic reaction centre."
1988,chemistry,Johann Deisenhofer,1943-09-30,Zusamaltheim,Germany,,"University of Texas Southwestern Medical Center at Dallas, Dallas, TX, USA, Howard Hughes Medical Institute","Biochemistry, structural chemistry",The Nobel Prize in Chemistry,"The Nobel Prize in Chemistry 1988 was awarded jointly to Johann Deisenhofer, Robert Huber and Hartmut Michel for the determination of the three-dimensional structure of a photosynthetic reaction centre."
1988,chemistry,Robert Huber,1937-02-20,Munich,Germany,,"Max-Planck-Institut für Biochemie, Martinsried, Federal Republic of Germany","Biochemistry, structural chemistry",The Nobel Prize in Chemistry,"The Nobel Prize in Chemistry 1988 was awarded jointly to Johann Deisenhofer, Robert Huber and Hartmut Michel for the determination of the three-dimensional structure of a photosynthetic reaction centre."
1988,economics,Maurice Allais,1911-05-31,Paris,France,,"École Nationale Supérieur des Mines de Paris, Paris, France", Partial and general equilibrium theory,The Prize in Economic Sciences,The Sveriges Riksbank Prize in Economic Sciences in Memory of Alfred Nobel 1988 was awarded to Maurice Allais for his pioneering contributions to the theory of markets and efficient utilization of resources.
1988,literature,Naguib Mahfouz,1911-12-11,Cairo,Egypt,Egypt,, Arabic,The Nobel Prize in Literature,"The Nobel Prize in Literature 1988 was awarded to Naguib Mahfouz who, through works rich in nuance - now clear-sightedly realistic, now evocatively ambiguous - has formed an Arabian narrative art that applies to all mankind."
1988,medicine,George H. Hitchings,1905-04-18,Hoquiam WA,USA,,"Wellcome Research Laboratories, Research Triangle Park, NC, USA",,The Nobel Prize in Physiology or Medicine,"The Nobel Prize in Physiology or Medicine 1988 was awarded jointly to Sir James W. Black, Gertrude B. Elion and George H. Hitchings for their discoveries of important principles for drug treatment."
1988,medicine,Gertrude B. Elion,1918-01-23,New York NY,USA,,"Wellcome Research Laboratories, Research Triangle Park, NC, USA",,The Nobel Prize in Physiology or Medicine,"The Nobel Prize in Physiology or Medicine 1988 was awarded jointly to Sir James W. Black, Gertrude B. Elion and George H. Hitchings for their discoveries of important principles for drug treatment."
1988,medicine,Sir James W. Black,1924-06-14,Uddingston,Scotland,,"London University, King's College Hospital Medical School, London, United Kingdom",,The Nobel Prize in Physiology or Medicine,"The Nobel Prize in Physiology or Medicine 1988 was awarded jointly to Sir James W. Black, Gertrude B. Elion and George H. Hitchings for their discoveries of important principles for drug treatment."
1988,peace,United Nations Peacekeeping Forces,1948-05-01,"New York, NY",USA,,, World organizing,The Nobel Peace Prize,The Nobel Peace Prize 1988 was awarded to United Nations Peacekeeping Forces.
1988,physics,Jack Steinberger,1921-05-25,Bad Kissingen,Germany,,"CERN, Geneva, Switzerland", Particle physics,The Nobel Prize in Physics,"The Nobel Prize in Physics 1988 was awarded jointly to Leon M. Lederman, Melvin Schwartz and Jack Steinberger for the neutrino beam method and the demonstration of the doublet structure of the leptons through the discovery of the muon neutrino."
1988,physics,Leon M. Lederman,1922-07-15,New York NY,USA,,"Fermi National Accelerator Laboratory, Batavia, IL, USA", Particle physics,The Nobel Prize in Physics,"The Nobel Prize in Physics 1988 was awarded jointly to Leon M. Lederman, Melvin Schwartz and Jack Steinberger for the neutrino beam method and the demonstration of the doublet structure of the leptons through the discovery of the muon neutrino."
1988,physics,Melvin Schwartz,1932-11-02,New York NY,USA,,"Digital Pathways, Inc., Mountain View, CA, USA", Particle physics,The Nobel Prize in Physics,"The Nobel Prize in Physics 1988 was awarded jointly to Leon M. Lederman, Melvin Schwartz and Jack Steinberger for the neutrino beam method and the demonstration of the doublet structure of the leptons through the discovery of the muon neutrino."
1989,chemistry,Sidney Altman,1939-05-07,Montreal,Canada,,"Yale University, New Haven, CT, USA", Biochemistry,The Nobel Prize in Chemistry,The Nobel Prize in Chemistry 1989 was awarded jointly to Sidney Altman and Thomas R. Cech for their discovery of catalytic properties of RNA
1989,chemistry,Thomas R. Cech,1947-12-08,Chicago IL,USA,,"University of Colorado, Boulder, CO, USA", Biochemistry,The Nobel Prize in Chemistry,The Nobel Prize in Chemistry 1989 was awarded jointly to Sidney Altman and Thomas R. Cech for their discovery of catalytic properties of RNA
1989,economics,Trygve Haavelmo,1911-12-13,Skedsmo,Norway,,"University of Oslo, Oslo, Norway", Econometrics,The Prize in Economic Sciences,The Sveriges Riksbank Prize in Economic Sciences in Memory of Alfred Nobel 1989 was awarded to Trygve Haavelmo for his clarification of the probability theory foundations of econometrics and his analyses of simultaneous economic structures.
1989,literature,Camilo José Cela,1916-05-11,Iria Flavia,Spain,Spain,, Spanish,The Nobel Prize in Literature,"The Nobel Prize in Literature 1989 was awarded to Camilo José Cela for a rich and intensive prose, which with restrained compassion forms a challenging vision of man's vulnerability."
1989,medicine,Harold E. Varmus,1939-12-18,Oceanside NY,USA,,"University of California School of Medicine, San Francisco, CA, USA",,The Nobel Prize in Physiology or Medicine,The Nobel Prize in Physiology or Medicine 1989 was awarded jointly to J. Michael Bishop and Harold E. Varmus for their discovery of the cellular origin of retroviral oncogenes
1989,medicine,J. Michael Bishop,1936-02-22,York PA,USA,,"University of California School of Medicine, San Francisco, CA, USA",,The Nobel Prize in Physiology or Medicine,The Nobel Prize in Physiology or Medicine 1989 was awarded jointly to J. Michael Bishop and Harold E. Varmus for their discovery of the cellular origin of retroviral oncogenes
1989,peace,The 14th Dalai Lama (Tenzin Gyatso),1935-07-06,Taktser,Tibet,Tibet,, Human rights,The Nobel Peace Prize,The Nobel Peace Prize 1989 was awarded to The 14th Dalai Lama.
1989,physics,Hans G. Dehmelt,1922-09-09,Görlitz,Germany,,"University of Washington, Seattle, WA, USA", Atomic physics,The Nobel Prize in Physics,"The Nobel Prize in Physics 1989 was divided, one half awarded to Norman F. Ramsey for the invention of the separated oscillatory fields method and its use in the hydrogen maser and other atomic clocks,the other half jointly to Hans G. Dehmelt and Wolfgang Paul for the development of the ion trap technique."
1989,physics,Norman F. Ramsey,1915-08-27,Washington DC,USA,,"Harvard University, Cambridge, MA, USA", Atomic physics,The Nobel Prize in Physics,"The Nobel Prize in Physics 1989 was divided, one half awarded to Norman F. Ramsey for the invention of the separated oscillatory fields method and its use in the hydrogen maser and other atomic clocks,the other half jointly to Hans G. Dehmelt and Wolfgang Paul for the development of the ion trap technique."
1989,physics,Wolfgang Paul,1913-08-10,Lorenzkirch,Germany,,"University of Bonn, Bonn, Federal Republic of Germany", Atomic physics,The Nobel Prize in Physics,"The Nobel Prize in Physics 1989 was divided, one half awarded to Norman F. Ramsey for the invention of the separated oscillatory fields method and its use in the hydrogen maser and other atomic clocks,the other half jointly to Hans G. Dehmelt and Wolfgang Paul for the development of the ion trap technique."
1990,chemistry,Elias James Corey,1928-07-12,Methuen MA,USA,,"Harvard University, Cambridge, MA, USA", Organic chemistry,The Nobel Prize in Chemistry,The Nobel Prize in Chemistry 1990 was awarded to Elias James Corey for his development of the theory and methodology of organic synthesis.
1990,economics,Harry M. Markowitz,1927-08-24,Chicago IL,USA,,"City University of New York, New York, NY, USA", Financial economics,The Prize in Economic Sciences,"The Sveriges Riksbank Prize in Economic Sciences in Memory of Alfred Nobel 1990 was awarded jointly to Harry M. Markowitz, Merton H. Miller and William F. Sharpe for their pioneering work in the theory of financial economics."
1990,economics,Merton H. Miller,1923-05-16,Boston MA,USA,,"University of Chicago, Chicago, IL, USA", Financial economics,The Prize in Economic Sciences,"The Sveriges Riksbank Prize in Economic Sciences in Memory of Alfred Nobel 1990 was awarded jointly to Harry M. Markowitz, Merton H. Miller and William F. Sharpe for their pioneering work in the theory of financial economics."
1990,economics,William F. Sharpe,1934-06-16,Boston MA,USA,,"Stanford University, Stanford, CA, USA", Financial economics,The Prize in Economic Sciences,"The Sveriges Riksbank Prize in Economic Sciences in Memory of Alfred Nobel 1990 was awarded jointly to Harry M. Markowitz, Merton H. Miller and William F. Sharpe for their pioneering work in the theory of financial economics."
1990,literature,Octavio Paz,1914-03-31,Mexico City,Mexico,Mexico,, Spanish,The Nobel Prize in Literature,"The Nobel Prize in Literature 1990 was awarded to Octavio Paz for impassioned writing with wide horizons, characterized by sensuous intelligence and humanistic integrity."
1990,medicine,E. Donnall Thomas,1920-03-15,Mart TX,USA,,"Fred Hutchinson Cancer Research Center, Seattle, WA, USA",,The Nobel Prize in Physiology or Medicine,The Nobel Prize in Physiology or Medicine 1990 was awarded jointly to Joseph E. Murray and E. Donnall Thomas for their discoveries concerning organ and cell transplantation in the treatment of human disease
1990,medicine,Joseph E. Murray,1919-04-01,Milford MA,USA,,"Brigham and Women's Hospital, Boston, MA, USA",,The Nobel Prize in Physiology or Medicine,The Nobel Prize in Physiology or Medicine 1990 was awarded jointly to Joseph E. Murray and E. Donnall Thomas for their discoveries concerning organ and cell transplantation in the treatment of human disease
1990,peace,Mikhail Sergeyevich Gorbachev,1931-03-02,Privolnoye,USSR,USSR, President of USSR,"Negotiation, world organizing, arms control and disarmament",The Nobel Peace Prize,The Nobel Peace Prize 1990 was awarded to Mikhail Gorbachev for his leading role in the peace process which today characterizes important parts of the international community.
1990,physics,Henry W. Kendall,1926-12-09,Boston MA,USA,,"Massachusetts Institute of Technology (MIT), Cambridge, MA, USA", Particle physics,The Nobel Prize in Physics,"The Nobel Prize in Physics 1990 was awarded jointly to Jerome I. Friedman, Henry W. Kendall and Richard E. Taylor for their pioneering investigations concerning deep inelastic scattering of electrons on protons and bound neutrons, which have been of essential importance for the development of the quark model in particle physics."
1990,physics,Jerome I. Friedman,1930-03-28,Chicago IL,USA,,"Massachusetts Institute of Technology (MIT), Cambridge, MA, USA", Particle physics,The Nobel Prize in Physics,"The Nobel Prize in Physics 1990 was awarded jointly to Jerome I. Friedman, Henry W. Kendall and Richard E. Taylor for their pioneering investigations concerning deep inelastic scattering of electrons on protons and bound neutrons, which have been of essential importance for the development of the quark model in particle physics."
1990,physics,Richard E. Taylor,1929-11-02,Medicine Hat Alberta,Canada,,"Stanford University, Stanford, CA, USA", Particle physics,The Nobel Prize in Physics,"The Nobel Prize in Physics 1990 was awarded jointly to Jerome I. Friedman, Henry W. Kendall and Richard E. Taylor for their pioneering investigations concerning deep inelastic scattering of electrons on protons and bound neutrons, which have been of essential importance for the development of the quark model in particle physics."
1991,chemistry,Richard R. Ernst,1933-08-14,Winterthur,Switzerland,,"Eidgenössische Technische Hochschule (Swiss Federal Institute of Technology), Zurich, Switzerland", Physical chemical methodology,The Nobel Prize in Chemistry,The Nobel Prize in Chemistry 1991 was awarded to Richard R. Ernst for his contributions to the development of the methodology of high resolution nuclear magnetic resonance (NMR) spectroscopy.
1991,economics,Ronald H. Coase,1910-12-29,Willesden,United Kingdom,,"University of Chicago, Chicago, IL, USA", Theory of market institutions,The Prize in Economic Sciences,The Sveriges Riksbank Prize in Economic Sciences in Memory of Alfred Nobel 1991 was awarded to Ronald H. Coase for his discovery and clarification of the significance of transaction costs and property rights for the institutional structure and functioning of the economy.
1991,literature,Nadine Gordimer,1923-11-20,Springs,South Africa,South Africa,, English,The Nobel Prize in Literature,The Nobel Prize in Literature 1991 was awarded to Nadine Gordimer who through her magnificent epic writing has - in the words of Alfred Nobel - been of very great benefit to humanity.
1991,medicine,Bert Sakmann,1942-06-12,Stuttgart,Germany,,"Max-Planck-Institut für medizinische Forschung, Heidelberg, Federal Republic of Germany",,The Nobel Prize in Physiology or Medicine,The Nobel Prize in Physiology or Medicine 1991 was awarded jointly to Erwin Neher and Bert Sakmann for their discoveries concerning the function of single ion channels in cells
1991,medicine,Erwin Neher,1944-03-20,Landsberg,Germany,,"Max-Planck-Institut für Biophysikalische Chemie, Goettingen, Federal Republic of Germany",,The Nobel Prize in Physiology or Medicine,The Nobel Prize in Physiology or Medicine 1991 was awarded jointly to Erwin Neher and Bert Sakmann for their discoveries concerning the function of single ion channels in cells
1991,peace,Aung San Suu Kyi,1945-06-19,Rangoon (now Yangon),Burma (now Myanmar),Burma,, Human rights,The Nobel Peace Prize,The Nobel Peace Prize 1991 was awarded to Aung San Suu Kyi for her non-violent struggle for democracy and human rights.
1991,physics,Pierre-Gilles de Gennes,1932-10-24,Paris,France,,"Collège de France, Paris, France", Condensed matter physics,The Nobel Prize in Physics,"The Nobel Prize in Physics 1991 was awarded to Pierre-Gilles de Gennes for discovering that methods developed for studying order phenomena in simple systems can be generalized to more complex forms of matter, in particular to liquid crystals and polymers."
1992,chemistry,Rudolph A. Marcus,1923-07-21,Montreal,Canada,,"California Institute of Technology (Caltech), Pasadena, CA, USA", Theoretical chemistry,The Nobel Prize in Chemistry,The Nobel Prize in Chemistry 1992 was awarded to Rudolph A. Marcus for his contributions to the theory of electron transfer reactions in chemical systems.
1992,economics,Gary S. Becker,1930-12-02,Pottsville PA,USA,,"University of Chicago, Chicago, IL, USA", Microeconomics and economic sociology,The Prize in Economic Sciences,"The Sveriges Riksbank Prize in Economic Sciences in Memory of Alfred Nobel 1992 was awarded to Gary S. Becker for having extended the domain of microeconomic analysis to a wide range of human behaviour and interaction, including nonmarket behaviour."
1992,literature,Derek Walcott,1930-01-23,Castries,Saint Lucia,Saint Lucia,, English,The Nobel Prize in Literature,"The Nobel Prize in Literature 1992 was awarded to Derek Walcott for a poetic oeuvre of great luminosity, sustained by a historical vision, the outcome of a multicultural commitment."
1992,medicine,Edmond H. Fischer,1920-04-06,Shanghai,China,,"University of Washington, Seattle, WA, USA",,The Nobel Prize in Physiology or Medicine,The Nobel Prize in Physiology or Medicine 1992 was awarded jointly to Edmond H. Fischer and Edwin G. Krebs for their discoveries concerning reversible protein phosphorylation as a biological regulatory mechanism
1992,medicine,Edwin G. Krebs,1918-06-06,Lansing IA,USA,,"University of Washington, Seattle, WA, USA",,The Nobel Prize in Physiology or Medicine,The Nobel Prize in Physiology or Medicine 1992 was awarded jointly to Edmond H. Fischer and Edwin G. Krebs for their discoveries concerning reversible protein phosphorylation as a biological regulatory mechanism
1992,peace,Rigoberta Menchú Tum,1959-01-09,Aldea Chimel,Guatemala,Guatemala,, Human rights,The Nobel Peace Prize,The Nobel Peace Prize 1992 was awarded to Rigoberta Menchú Tum in recognition of her work for social justice and ethno-cultural reconciliation based on respect for the rights of indigenous peoples.
1992,physics,Georges Charpak,1924-08-01,Dabrovica,Poland,,"École Supérieure de Physique et Chimie, Paris, France, CERN, Geneva, Switzerland", Instrumentation,The Nobel Prize in Physics,"The Nobel Prize in Physics 1992 was awarded to Georges Charpak for his invention and development of particle detectors, in particular the multiwire proportional chamber."
