Year,Category,Name,Birthdate,Birth Place,County,Residence,Role/Affiliate,Field/Language,Prize Name,Motivation
1964,physics,Charles Hard Townes,1915-07-28,Greenville SC,USA,,"Massachusetts Institute of Technology (MIT), Cambridge, MA, USA","Quantum electrodynamics, optical physics",The Nobel Prize in Physics,"The Nobel Prize in Physics 1964 was divided, one half awarded to Charles Hard Townes for fundamental work in the field of quantum electronics, which has led to the construction of oscillators and amplifiers based on the maser-laser principle,the other half jointly to Nicolay Gennadiyevich Basov and Aleksandr Mikhailovich Prokhorov for fundamental work in the field of quantum electronics, which has led to the construction of oscillators and amplifiers based on the maser-laser principle."
1964,physics,Nicolay Gennadiyevich Basov,1922-12-14,Usman Russia,Soviet Union,,"P.N. Lebedev Physical Institute, Moscow, USSR","Quantum electrodynamics, optical physics",The Nobel Prize in Physics,"The Nobel Prize in Physics 1964 was divided, one half awarded to Charles Hard Townes for fundamental work in the field of quantum electronics, which has led to the construction of oscillators and amplifiers based on the maser-laser principle,the other half jointly to Nicolay Gennadiyevich Basov and Aleksandr Mikhailovich Prokhorov for fundamental work in the field of quantum electronics, which has led to the construction of oscillators and amplifiers based on the maser-laser principle."
1965,chemistry,Robert Burns Woodward,1917-04-10,Boston MA,USA,,"Harvard University, Cambridge, MA, USA","Organic chemistry, natural products chemistry",The Nobel Prize in Chemistry,The Nobel Prize in Chemistry 1965 was awarded to Robert B. Woodward for his outstanding achievements in the art of organic synthesis.
1965,literature,Mikhail Aleksandrovich Sholokhov,1905-06-24,Veshenskaya,Russia,USSR,, Russian,The Nobel Prize in Literature,"The Nobel Prize in Literature 1965 was awarded to Mikhail Sholokhov for the artistic power and integrity with which, in his epic of the Don, he has given expression to a historic phase in the life of the Russian people."
1965,medicine,André Lwoff,1902-05-08,Ainay-le-Château,France,,"Institut Pasteur, Paris, France",,The Nobel Prize in Physiology or Medicine,"The Nobel Prize in Physiology or Medicine 1965 was awarded jointly to François Jacob, André Lwoff and Jacques Monod for their discoveries concerning genetic control of enzyme and virus synthesis."
1965,medicine,François Jacob,1920-06-17,Nancy,France,,"Institut Pasteur, Paris, France",,The Nobel Prize in Physiology or Medicine,"The Nobel Prize in Physiology or Medicine 1965 was awarded jointly to François Jacob, André Lwoff and Jacques Monod for their discoveries concerning genetic control of enzyme and virus synthesis."
1965,medicine,Jacques Monod,1910-02-09,Paris,France,,"Institut Pasteur, Paris, France",,The Nobel Prize in Physiology or Medicine,"The Nobel Prize in Physiology or Medicine 1965 was awarded jointly to François Jacob, André Lwoff and Jacques Monod for their discoveries concerning genetic control of enzyme and virus synthesis."
1965,peace,United Nations Children's Fund (UNICEF),1946-12-11,"New York, NY",USA,, An international aid organization established by the UN, Humanitarian work,The Nobel Peace Prize,The Nobel Peace Prize 1965 was awarded to United Nations Children's Fund.
1965,physics,Julian Schwinger,1918-02-12,New York NY,USA,,"Harvard University, Cambridge, MA, USA","Quantum mechanics, quantum electrodynamics",The Nobel Prize in Physics,"The Nobel Prize in Physics 1965 was awarded jointly to Sin-Itiro Tomonaga, Julian Schwinger and Richard P. Feynman for their fundamental work in quantum electrodynamics, with deep-ploughing consequences for the physics of elementary particles."
1965,physics,Richard P. Feynman,1918-05-11,New York NY,USA,,"California Institute of Technology (Caltech), Pasadena, CA, USA","Quantum mechanics, quantum electrodynamics",The Nobel Prize in Physics,"The Nobel Prize in Physics 1965 was awarded jointly to Sin-Itiro Tomonaga, Julian Schwinger and Richard P. Feynman for their fundamental work in quantum electrodynamics, with deep-ploughing consequences for the physics of elementary particles."
1965,physics,Sin-Itiro Tomonaga,1906-03-31,Kyoto,Japan,,"Tokyo University of Education, Tokyo, Japan","Quantum mechanics, quantum electrodynamics",The Nobel Prize in Physics,"The Nobel Prize in Physics 1965 was awarded jointly to Sin-Itiro Tomonaga, Julian Schwinger and Richard P. Feynman for their fundamental work in quantum electrodynamics, with deep-ploughing consequences for the physics of elementary particles."
1966,chemistry,Robert S. Mulliken,1896-07-07,Newburyport MA,USA,,"University of Chicago, Chicago, IL, USA","Theoretical chemistry, chemical bonding",The Nobel Prize in Chemistry,The Nobel Prize in Chemistry 1966 was awarded to Robert S. Mulliken for his fundamental work concerning chemical bonds and the electronic structure of molecules by the molecular orbital method.
1966,literature,Nelly Sachs,1891-12-10,Berlin,Germany,Sweden,, German,The Nobel Prize in Literature,"The Nobel Prize in Literature 1966 was divided equally between Shmuel Yosef Agnon for his profoundly characteristic narrative art with motifs from the life of the Jewish people and Nelly Sachs for her outstanding lyrical and dramatic writing, which interprets Israel's destiny with touching strength ."
1966,literature,Shmuel Yosef Agnon,1888-07-17,Buczacz (now Buchach),Austria-Hungary (now Ukraine),Israel,, Hebrew,The Nobel Prize in Literature,"The Nobel Prize in Literature 1966 was divided equally between Shmuel Yosef Agnon for his profoundly characteristic narrative art with motifs from the life of the Jewish people and Nelly Sachs for her outstanding lyrical and dramatic writing, which interprets Israel's destiny with touching strength ."
1966,medicine,Charles Brenton Huggins,1901-09-22,Halifax,Canada,,"University of Chicago, Ben May Laboratory for Cancer Research, Chicago, IL, USA",,The Nobel Prize in Physiology or Medicine,The Nobel Prize in Physiology or Medicine 1966 was divided equally between Peyton Rous for his discovery of tumour-inducing viruses and Charles Brenton Huggins for his discoveries concerning hormonal treatment of prostatic cancer.
1966,medicine,Peyton Rous,1879-10-05,Baltimore MD,USA,,"Rockefeller University, New York, NY, USA",,The Nobel Prize in Physiology or Medicine,The Nobel Prize in Physiology or Medicine 1966 was divided equally between Peyton Rous for his discovery of tumour-inducing viruses and Charles Brenton Huggins for his discoveries concerning hormonal treatment of prostatic cancer.
1966,physics,Alfred Kastler,1902-05-03,Guebwiller,Germany (now France),,"École Normale Supérieure, Paris, France", Optical physics,The Nobel Prize in Physics,The Nobel Prize in Physics 1966 was awarded to Alfred Kastler for the discovery and development of optical methods for studying Hertzian resonances in atoms.
1967,chemistry,George Porter,1920-12-06,Stainforth,United Kingdom,,"Royal Institution of Great Britain, London, United Kingdom","Physical chemistry, chemical kinetics",The Nobel Prize in Chemistry,"The Nobel Prize in Chemistry 1967 was divided, one half awarded to Manfred Eigen for their studies of extremely fast chemical reactions, effected by disturbing the equlibrium by means of very short pulses of energy,the other half jointly to Ronald George Wreyford Norrish and George Porter for their studies of extremely fast chemical reactions, effected by disturbing the equlibrium by means of very short pulses of energy."
1967,chemistry,Manfred Eigen,1927-05-09,Bochum,Germany,,"Max-Planck-Institut für Physikalische Chemie, Goettingen, Federal Republic of Germany","Physical chemistry, chemical kinetics",The Nobel Prize in Chemistry,"The Nobel Prize in Chemistry 1967 was divided, one half awarded to Manfred Eigen for their studies of extremely fast chemical reactions, effected by disturbing the equlibrium by means of very short pulses of energy,the other half jointly to Ronald George Wreyford Norrish and George Porter for their studies of extremely fast chemical reactions, effected by disturbing the equlibrium by means of very short pulses of energy."
1967,chemistry,Ronald George Wreyford Norrish,1897-11-09,Cambridge,United Kingdom,,"Institute of Physical Chemistry, Cambridge, United Kingdom","Physical chemistry, chemical kinetics",The Nobel Prize in Chemistry,"The Nobel Prize in Chemistry 1967 was divided, one half awarded to Manfred Eigen for their studies of extremely fast chemical reactions, effected by disturbing the equlibrium by means of very short pulses of energy,the other half jointly to Ronald George Wreyford Norrish and George Porter for their studies of extremely fast chemical reactions, effected by disturbing the equlibrium by means of very short pulses of energy."
1967,literature,Miguel Angel Asturias,1899-10-19,Guatemala City,Guatemala,Guatemala,, Spanish,The Nobel Prize in Literature,"The Nobel Prize in Literature 1967 was awarded to Miguel Angel Asturias for his vivid literary achievement, deep-rooted in the national traits and traditions of Indian peoples of Latin America."
1967,medicine,George Wald,1906-11-18,New York NY,USA,,"Harvard University, Cambridge, MA, USA",,The Nobel Prize in Physiology or Medicine,"The Nobel Prize in Physiology or Medicine 1967 was awarded jointly to Ragnar Granit, Haldan Keffer Hartline and George Wald for their discoveries concerning the primary physiological and chemical visual processes in the eye."
1967,medicine,Haldan Keffer Hartline,1903-12-22,Bloomsburg PA,USA,,"Rockefeller University, New York, NY, USA",,The Nobel Prize in Physiology or Medicine,"The Nobel Prize in Physiology or Medicine 1967 was awarded jointly to Ragnar Granit, Haldan Keffer Hartline and George Wald for their discoveries concerning the primary physiological and chemical visual processes in the eye."
1967,medicine,Ragnar Granit,1900-10-30,Helsinki,Finland,,"Karolinska Institutet, Stockholm, Sweden",,The Nobel Prize in Physiology or Medicine,"The Nobel Prize in Physiology or Medicine 1967 was awarded jointly to Ragnar Granit, Haldan Keffer Hartline and George Wald for their discoveries concerning the primary physiological and chemical visual processes in the eye."
1967,physics,Hans Albrecht Bethe,1906-07-02,Strassburg (now Strasbourg),Germany (now France),,"Cornell University, Ithaca, NY, USA", Astrophysics,The Nobel Prize in Physics,"The Nobel Prize in Physics 1967 was awarded to Hans Bethe for his contributions to the theory of nuclear reactions, especially his discoveries concerning the energy production in stars."
1968,chemistry,Lars Onsager,1903-11-27,Kristiania (now Oslo),Norway,,"Yale University, New Haven, CT, USA","Physical chemistry, chemical thermodynamics",The Nobel Prize in Chemistry,"The Nobel Prize in Chemistry 1968 was awarded to Lars Onsager for the discovery of the reciprocal relations bearing his name, which are fundamental for the thermodynamics of irreversible processes."
1968,literature,Yasunari Kawabata,1899-06-11,Osaka,Japan,Japan,, Japanese,The Nobel Prize in Literature,"The Nobel Prize in Literature 1968 was awarded to Yasunari Kawabata for his narrative mastery, which with great sensibility expresses the essence of the Japanese mind."
1968,medicine,Har Gobind Khorana,1922-01-09,Raipur,India,,"University of Wisconsin, Madison, WI, USA",,The Nobel Prize in Physiology or Medicine,"The Nobel Prize in Physiology or Medicine 1968 was awarded jointly to Robert W. Holley, Har Gobind Khorana and Marshall W. Nirenberg for their interpretation of the genetic code and its function in protein synthesis."
1968,medicine,Marshall W. Nirenberg,1927-04-10,New York NY,USA,,"National Institutes of Health, Bethesda, MD, USA",,The Nobel Prize in Physiology or Medicine,"The Nobel Prize in Physiology or Medicine 1968 was awarded jointly to Robert W. Holley, Har Gobind Khorana and Marshall W. Nirenberg for their interpretation of the genetic code and its function in protein synthesis."
1968,medicine,Robert W. Holley,1922-01-28,Urbana IL,USA,,"Cornell University, Ithaca, NY, USA",,The Nobel Prize in Physiology or Medicine,"The Nobel Prize in Physiology or Medicine 1968 was awarded jointly to Robert W. Holley, Har Gobind Khorana and Marshall W. Nirenberg for their interpretation of the genetic code and its function in protein synthesis."
1968,peace,René Cassin,1887-10-05,Bayonne,France,France, President of the European Court for Human Rights, Human rights,The Nobel Peace Prize,The Nobel Peace Prize 1968 was awarded to René Cassin.
1968,physics,Luis Walter Alvarez,1911-06-13,San Francisco CA,USA,,"University of California, Berkeley, CA, USA", Particle physics,The Nobel Prize in Physics,"The Nobel Prize in Physics 1968 was awarded to Luis Alvarez for his decisive contributions to elementary particle physics, in particular the discovery of a large number of resonance states, made possible through his development of the technique of using hydrogen bubble chamber and data analysis."
1969,chemistry,Derek H. R. Barton,1918-09-08,Gravesend,United Kingdom,,"Imperial College, London, United Kingdom","Organic chemistry, stereochemistry",The Nobel Prize in Chemistry,The Nobel Prize in Chemistry 1969 was awarded jointly to Derek H. R. Barton and Odd Hassel for their contributions to the development of the concept of conformation and its application in chemistry
1969,chemistry,Odd Hassel,1897-05-17,Kristiania (now Oslo),Norway,,"University of Oslo, Oslo, Norway","Organic chemistry, stereochemistry",The Nobel Prize in Chemistry,The Nobel Prize in Chemistry 1969 was awarded jointly to Derek H. R. Barton and Odd Hassel for their contributions to the development of the concept of conformation and its application in chemistry
1969,economics,Jan Tinbergen,1903-04-12,the Hague,the Netherlands,,"The Netherlands School of Economics, Rotterdam, the Netherlands", Econometrics,The Prize in Economic Sciences,The Sveriges Riksbank Prize in Economic Sciences in Memory of Alfred Nobel 1969 was awarded jointly to Ragnar Frisch and Jan Tinbergen for having developed and applied dynamic models for the analysis of economic processes
1969,economics,Ragnar Frisch,1895-03-03,Oslo,Norway,,"University of Oslo, Oslo, Norway", Econometrics,The Prize in Economic Sciences,The Sveriges Riksbank Prize in Economic Sciences in Memory of Alfred Nobel 1969 was awarded jointly to Ragnar Frisch and Jan Tinbergen for having developed and applied dynamic models for the analysis of economic processes
1969,literature,Samuel Beckett,1906-04-13,Dublin,Ireland,Ireland,, English and French,The Nobel Prize in Literature,"The Nobel Prize in Literature 1969 was awarded to Samuel Beckett for his writing, which - in new forms for the novel and drama - in the destitution of modern man acquires its elevation."
1969,medicine,Alfred D. Hershey,1908-12-04,Owosso MI,USA,,"Carnegie Institution of Washington, Long Island, New York, NY, USA",,The Nobel Prize in Physiology or Medicine,"The Nobel Prize in Physiology or Medicine 1969 was awarded jointly to Max Delbrück, Alfred D. Hershey and Salvador E. Luria for their discoveries concerning the replication mechanism and the genetic structure of viruses."
1969,medicine,Max Delbrück,1906-09-04,Berlin,Germany,,"California Institute of Technology (Caltech), Pasadena, CA, USA",,The Nobel Prize in Physiology or Medicine,"The Nobel Prize in Physiology or Medicine 1969 was awarded jointly to Max Delbrück, Alfred D. Hershey and Salvador E. Luria for their discoveries concerning the replication mechanism and the genetic structure of viruses."
1969,medicine,Salvador E. Luria,1912-08-13,Torino,Italy,,"Massachusetts Institute of Technology (MIT), Cambridge, MA, USA",,The Nobel Prize in Physiology or Medicine,"The Nobel Prize in Physiology or Medicine 1969 was awarded jointly to Max Delbrück, Alfred D. Hershey and Salvador E. Luria for their discoveries concerning the replication mechanism and the genetic structure of viruses."
1969,peace,International Labour Organization (I.L.O.),1919-06-28,Geneva,Switzerland,,,"World organization, human rights",The Nobel Peace Prize,The Nobel Peace Prize 1969 was awarded to International Labour Organization.
1969,physics,Murray Gell-Mann,1929-09-15,New York NY,USA,,"California Institute of Technology (Caltech), Pasadena, CA, USA", Particle physics,The Nobel Prize in Physics,The Nobel Prize in Physics 1969 was awarded to Murray Gell-Mann for his contributions and discoveries concerning the classification of elementary particles and their interactions.
1970,chemistry,Luis F. Leloir,1906-09-06,Paris,France,,"Institute for Biochemical Research, Buenos Aires, Argentina", Biochemistry,The Nobel Prize in Chemistry,The Nobel Prize in Chemistry 1970 was awarded to Luis Leloir for his discovery of sugar nucleotides and their role in the biosynthesis of carbohydrates.
1970,economics,Paul A. Samuelson,1915-05-15,Gary IN,USA,,"Massachusetts Institute of Technology (MIT), Cambridge, MA, USA", Partial and general equilibrium theory,The Prize in Economic Sciences,The Sveriges Riksbank Prize in Economic Sciences in Memory of Alfred Nobel 1970 was awarded to Paul A. Samuelson for the scientific work through which he has developed static and dynamic economic theory and actively contributed to raising the level of analysis in economic science.
1970,literature,Aleksandr Isayevich Solzhenitsyn,1918-12-11,Kislovodsk,Russia,USSR,, Russian,The Nobel Prize in Literature,The Nobel Prize in Literature 1970 was awarded to Alexandr Solzhenitsyn for the ethical force with which he has pursued the indispensable traditions of Russian literature.
1970,medicine,Julius Axelrod,1912-05-30,New York NY,USA,,"National Institutes of Health, Bethesda, MD, USA",,The Nobel Prize in Physiology or Medicine,"The Nobel Prize in Physiology or Medicine 1970 was awarded jointly to Sir Bernard Katz, Ulf von Euler and Julius Axelrod for their discoveries concerning the humoral transmittors in the nerve terminals and the mechanism for their storage, release and inactivation."
1970,medicine,Sir Bernard Katz,1911-03-26,Leipzig,Germany,,"University College, London, United Kingdom",,The Nobel Prize in Physiology or Medicine,"The Nobel Prize in Physiology or Medicine 1970 was awarded jointly to Sir Bernard Katz, Ulf von Euler and Julius Axelrod for their discoveries concerning the humoral transmittors in the nerve terminals and the mechanism for their storage, release and inactivation."
1970,medicine,Ulf von Euler,1905-02-07,Stockholm,Sweden,,"Karolinska Institutet, Stockholm, Sweden",,The Nobel Prize in Physiology or Medicine,"The Nobel Prize in Physiology or Medicine 1970 was awarded jointly to Sir Bernard Katz, Ulf von Euler and Julius Axelrod for their discoveries concerning the humoral transmittors in the nerve terminals and the mechanism for their storage, release and inactivation."
1970,peace,Norman E. Borlaug,1914-03-25,Cresco IA,USA,USA,"International Maize and Wheat Improvement Center, Mexico City", Humanitarian work,The Nobel Peace Prize,The Nobel Peace Prize 1970 was awarded to Norman Borlaug.
1970,physics,Hannes Olof Gösta Alfvén,1908-05-30,Norrköping,Sweden,,"Royal Institute of Technology, Stockholm, Sweden", Plasma physics,The Nobel Prize in Physics,The Nobel Prize in Physics 1970 was divided equally between Hannes Olof Gösta Alfvén for fundamental work and discoveries in magnetohydro- dynamics with fruitful applications in different parts of plasma physics and Louis Eugène Félix Néel for fundamental work and discoveries concerning antiferromagnetism and ferrimagnetism which have led to important applications in solid state physics.
1970,physics,Louis Eugène Félix Néel,1904-11-22,Lyon,France,,"University of Grenoble, Grenoble, France","Electromagnetism, condensed matter physics",The Nobel Prize in Physics,The Nobel Prize in Physics 1970 was divided equally between Hannes Olof Gösta Alfvén for fundamental work and discoveries in magnetohydro- dynamics with fruitful applications in different parts of plasma physics and Louis Eugène Félix Néel for fundamental work and discoveries concerning antiferromagnetism and ferrimagnetism which have led to important applications in solid state physics.
1971,chemistry,Gerhard Herzberg,1904-12-25,Hamburg,Germany,,"National Research Council of Canada, Ottawa, Canada","Physical chemistry, molecular structures",The Nobel Prize in Chemistry,"The Nobel Prize in Chemistry 1971 was awarded to Gerhard Herzberg for his contributions to the knowledge of electronic structure and geometry of molecules, particularly free radicals."
1971,economics,Simon Kuznets,1901-04-30,Kharkov (now Kharkiv),Russian Empire (now Ukraine),,"Harvard University, Cambridge, MA, USA", Economic growth and economic history,The Prize in Economic Sciences,The Sveriges Riksbank Prize in Economic Sciences in Memory of Alfred Nobel 1971 was awarded to Simon Kuznets for his empirically founded interpretation of economic growth which has led to new and deepened insight into the economic and social structure and process of development.
1971,literature,Pablo Neruda,1904-07-12,Parral,Chile,Chile,, Spanish,The Nobel Prize in Literature,The Nobel Prize in Literature 1971 was awarded to Pablo Neruda for a poetry that with the action of an elemental force brings alive a continent's destiny and dreams.
1971,medicine,"Earl W. Sutherland, Jr.",1915-11-19,Burlingame KS,USA,,"Vanderbilt University, Nashville, TN, USA",,The Nobel Prize in Physiology or Medicine,"The Nobel Prize in Physiology or Medicine 1971 was awarded to Earl W. Sutherland, Jr. for his discoveries concerning the mechanisms of the action of hormones."
1971,peace,Willy Brandt,1913-12-18,Lübeck,Germany,Federal Republic of Germany, Chancellor of the Federal Republic of Germany,"Negotiation, world organizing",The Nobel Peace Prize,The Nobel Peace Prize 1971 was awarded to Willy Brandt.
1971,physics,Dennis Gabor,1900-06-05,Budapest,Hungary,,"Imperial College, London, United Kingdom", Optical physics,The Nobel Prize in Physics,The Nobel Prize in Physics 1971 was awarded to Dennis Gabor for his invention and development of the holographic method.
1972,chemistry,Christian B. Anfinsen,1916-03-26,Monessen PA,USA,,"National Institutes of Health, Bethesda, MD, USA","Biochemistry, analytical biochemistry",The Nobel Prize in Chemistry,"The Nobel Prize in Chemistry 1972 was divided, one half awarded to Christian B. Anfinsen for his work on ribonuclease, especially concerning the connection between the amino acid sequence and the biologically active conformation,the other half jointly to Stanford Moore and William H. Stein for their contribution to the understanding of the connection between chemical structure and catalytic activity of the active centre of the ribonuclease molecule."
1972,chemistry,Stanford Moore,1913-09-04,Chicago IL,USA,,"Rockefeller University, New York, NY, USA","Biochemistry, analytical biochemistry",The Nobel Prize in Chemistry,"The Nobel Prize in Chemistry 1972 was divided, one half awarded to Christian B. Anfinsen for his work on ribonuclease, especially concerning the connection between the amino acid sequence and the biologically active conformation,the other half jointly to Stanford Moore and William H. Stein for their contribution to the understanding of the connection between chemical structure and catalytic activity of the active centre of the ribonuclease molecule."
1972,chemistry,William H. Stein,1911-06-25,New York NY,USA,,"Rockefeller University, New York, NY, USA","Biochemistry, analytical biochemistry",The Nobel Prize in Chemistry,"The Nobel Prize in Chemistry 1972 was divided, one half awarded to Christian B. Anfinsen for his work on ribonuclease, especially concerning the connection between the amino acid sequence and the biologically active conformation,the other half jointly to Stanford Moore and William H. Stein for their contribution to the understanding of the connection between chemical structure and catalytic activity of the active centre of the ribonuclease molecule."
1972,economics,John R. Hicks,1904-04-08,Warwick,United Kingdom,,"All Souls College, Oxford, United Kingdom","General equilibrium theory, welfare theory",The Prize in Economic Sciences,The Sveriges Riksbank Prize in Economic Sciences in Memory of Alfred Nobel 1972 was awarded jointly to John R. Hicks and Kenneth J. Arrow for their pioneering contributions to general economic equilibrium theory and welfare theory
1972,economics,Kenneth J. Arrow,1921-08-23,New York NY,USA,,"Harvard University, Cambridge, MA, USA","General equilibrium theory, welfare theory",The Prize in Economic Sciences,The Sveriges Riksbank Prize in Economic Sciences in Memory of Alfred Nobel 1972 was awarded jointly to John R. Hicks and Kenneth J. Arrow for their pioneering contributions to general economic equilibrium theory and welfare theory
1972,literature,Heinrich Böll,1917-12-21,Cologne,Germany,Federal Republic of Germany,, German,The Nobel Prize in Literature,The Nobel Prize in Literature 1972 was awarded to Heinrich Böll for his writing which through its combination of a broad perspective on his time and a sensitive skill in characterization has contributed to a renewal of German literature.
1972,medicine,Gerald M. Edelman,1929-07-01,New York NY,USA,,"Rockefeller University, New York, NY, USA",,The Nobel Prize in Physiology or Medicine,The Nobel Prize in Physiology or Medicine 1972 was awarded jointly to Gerald M. Edelman and Rodney R. Porter for their discoveries concerning the chemical structure of antibodies
